,title,category,url,num_views,last_reply_date
0,I Signed - The House Purchase Saga,Money,https://tw.forumosa.com/t/i-signed-the-house-purchase-saga/216457,8880,"December 14, 2022"
1,Had great fun freezing my ex-employer's assets today,Legal - Work,https://tw.forumosa.com/t/had-great-fun-freezing-my-ex-employers-assets-today/220110,3839,"July 21, 2022"
2,I looked into Taiwan’s pension so you don’t have to,Money,https://tw.forumosa.com/t/i-looked-into-taiwan-s-pension-so-you-don-t-have-to/217916,1596,"December 21, 2022"
3,Going from Taiwan's Gold Card to Taiwanese Citizenship,Visa & Residency,https://tw.forumosa.com/t/going-from-taiwans-gold-card-to-taiwanese-citizenship/223715,1274,"January 19, 2023"
4,"Bye bye wife (2012-2022), bye bye Taiwan (2015-2022) - it feels awful Oki",Dating & Relationships,https://tw.forumosa.com/t/bye-bye-wife-2012-2022-bye-bye-taiwan-2015-2022-it-feels-awful-oki/220799,4097,"August 8, 2022"
5,High Court orders ex-employer to restore my labor pension account,Legal - Work,https://tw.forumosa.com/t/high-court-orders-ex-employer-to-restore-my-labor-pension-account/218958,749,"December 3, 2022"
6,Wear a Helmet,Cycling,https://tw.forumosa.com/t/wear-a-helmet/217625,906,"March 9, 2022"
7,We recorded all our expenses for 2 adults/1 child in New Taipei,Living in Taiwan,https://tw.forumosa.com/t/we-recorded-all-our-expenses-for-2-adults-1-child-in-new-taipei/222157,580,"August 2, 2022"
8,I finally got the lathe,Technology,https://tw.forumosa.com/t/i-finally-got-the-lathe/219023,614,"June 29, 2022"
9,"If You See My Children in Kaohsiung, Tell Them I Love Them!",Legal - Divorce,https://tw.forumosa.com/t/if-you-see-my-children-in-kaohsiung-tell-them-i-love-them/223852,1684,"December 19, 2022"
10,"Happy New Year, Forumosa!",Open Forum,https://tw.forumosa.com/t/happy-new-year-forumosa/226358,441,"January 2, 2023"
11,Another complaint for a mildly annoying part of life,Living in Taiwan,https://tw.forumosa.com/t/another-complaint-for-a-mildly-annoying-part-of-life/223075,733,"January 16, 2023"
12,No Public Transport discounts for Foreigners - let's get this fixed,Living in Taiwan,https://tw.forumosa.com/t/no-public-transport-discounts-for-foreigners-lets-get-this-fixed/219859,1034,"October 7, 2022"
13,Peak ChaBuDuo thread,Living in Taiwan,https://tw.forumosa.com/t/peak-chabuduo-thread/226131,808,"December 25, 2022"
14,Taiwan is a xenophobic country. Change my mind,Living in Taiwan,https://tw.forumosa.com/t/taiwan-is-a-xenophobic-country-change-my-mind/223919,5351,"November 9, 2022"
15,Guitars available for pre order,Buy and Sell,https://tw.forumosa.com/t/guitars-available-for-pre-order/222503,3945,"December 7, 2022"
16,Taking pictures of strangers is considerably weird,Dating & Relationships,https://tw.forumosa.com/t/taking-pictures-of-strangers-is-considerably-weird/220980,1217,"January 25, 2023"
17,Problems during quarantine,Health & Fitness,https://tw.forumosa.com/t/problems-during-quarantine/216979,2195,"May 18, 2022"
18,Taiwanese stereotypes about foreigners/countries that are actually more true for Taiwan,Living in Taiwan,https://tw.forumosa.com/t/taiwanese-stereotypes-about-foreigners-countries-that-are-actually-more-true-for-taiwan/217442,4466,"July 11, 2022"
19,Personal experiences in the testing/reporting/quarantine process,Living in Taiwan,https://tw.forumosa.com/t/personal-experiences-in-the-testing-reporting-quarantine-process/219553,3723,"June 15, 2022"
20,SE Asian dating a local guy,Dating & Relationships,https://tw.forumosa.com/t/se-asian-dating-a-local-guy/220952,1673,"June 26, 2022"
21,Tell us your happy Taiwanese relationship story,Dating & Relationships,https://tw.forumosa.com/t/tell-us-your-happy-taiwanese-relationship-story/225915,1595,"January 18, 2023"
22,Doorstepped by the Immigration Agency,Visa & Residency,https://tw.forumosa.com/t/doorstepped-by-the-immigration-agency/221038,2548,"July 13, 2022"
23,Traditional funeral in Taiwan...some observations,Living in Taiwan,https://tw.forumosa.com/t/traditional-funeral-in-taiwan-some-observations/216674,777,"February 8, 2022"
24,Saving Face,Working in Taiwan,https://tw.forumosa.com/t/saving-face/223999,516,"September 30, 2022"
25,"Taiwan to distribute surplus tax revenue, NT$6,000 to every citizen",Taiwan Politics,https://tw.forumosa.com/t/taiwan-to-distribute-surplus-tax-revenue-nt-6-000-to-every-citizen/226442,3541,"January 16, 2023"
26,Coronavirus Taiwan - Specific Developments April 2022,Living in Taiwan,https://tw.forumosa.com/t/coronavirus-taiwan-specific-developments-april-2022/218412,30045,"May 1, 2022"
27,TSMC’s U.S. Engineers Are “Babies” Say Taiwanese,Working in Taiwan,https://tw.forumosa.com/t/tsmc-s-u-s-engineers-are-babies-say-taiwanese/225101,3904,"January 14, 2023"
28,My new album is out!,Arts & Entertainment,https://tw.forumosa.com/t/my-new-album-is-out/226637,421,"January 15, 2023"
29,Coronavirus Taiwan - Specific Developments July-October 2022,Living in Taiwan,https://tw.forumosa.com/t/coronavirus-taiwan-specific-developments-july-october-2022/221296,32103,"November 3, 2022"
30,10th Year On Forumosa,Testimonials,https://tw.forumosa.com/t/10th-year-on-forumosa/219513,458,"May 6, 2022"
31,Coronavirus Taiwan - Specific Developments May/June 2022,Living in Taiwan,https://tw.forumosa.com/t/coronavirus-taiwan-specific-developments-may-june-2022/219365,39532,"July 1, 2022"
32,Banks trying to improve?,Money,https://tw.forumosa.com/t/banks-trying-to-improve/220493,1304,"September 30, 2022"
33,"Student in Taiwan performing poorly, mother looks in schoolbag",Open Forum,https://tw.forumosa.com/t/student-in-taiwan-performing-poorly-mother-looks-in-schoolbag/221190,574,"July 16, 2022"
34,Logged out of Forumosa,Site Feedback,https://tw.forumosa.com/t/logged-out-of-forumosa/217571,878,"March 12, 2022"
35,Advice on financial aspects in dating a taiwanese woman,Dating & Relationships,https://tw.forumosa.com/t/advice-on-financial-aspects-in-dating-a-taiwanese-woman/217373,3884,"July 11, 2022"
36,Lost a close friend this summer,Open Forum,https://tw.forumosa.com/t/lost-a-close-friend-this-summer/223340,771,"September 15, 2022"
37,Funny Political Pictures 2023,International Politics,https://tw.forumosa.com/t/funny-political-pictures-2023/226371,2443,"January 25, 2023"
38,List of Non-discriminatory Financial Service Providers,Money,https://tw.forumosa.com/t/list-of-non-discriminatory-financial-service-providers/224215,549,"November 17, 2022"
39,Pelosi visiting Taiwan in August 2022,Taiwan Politics,https://tw.forumosa.com/t/pelosi-visiting-taiwan-in-august-2022/221899,9157,"January 24, 2023"
40,Types of Store Clerks in Taiwan [A 外國人 Perspective],Living in Taiwan,https://tw.forumosa.com/t/types-of-store-clerks-in-taiwan-a-perspective/222042,774,"July 29, 2022"
41,Dry January (Accountability group),Open Forum,https://tw.forumosa.com/t/dry-january-accountability-group/226318,2723,"January 25, 2023"
42,China protests / uprisings - the start of Chinese Revolution 3.0? Effects on Taiwan?,Greater Forumosa,https://tw.forumosa.com/t/china-protests-uprisings-the-start-of-chinese-revolution-3-0-effects-on-taiwan/225547,4003,"January 4, 2023"
43,Survival gardens for small spaces: Good species to grow,Living in Taiwan,https://tw.forumosa.com/t/survival-gardens-for-small-spaces-good-species-to-grow/217898,1167,"January 23, 2023"
44,Quordle (Wordle x 4),Fun & Games,https://tw.forumosa.com/t/quordle-wordle-x-4/217008,27721,"January 25, 2023"
45,"‘Online’ Bank’s xenophobic reasoning for denying ""foreigners"" the ability to open an account online",Money,https://tw.forumosa.com/t/online-bank-s-xenophobic-reasoning-for-denying-foreigners-the-ability-to-open-an-account-online/222752,6299,"January 9, 2023"
46,:hiking_boot: Hiking - How was your hike today?,Sports,https://tw.forumosa.com/t/hiking-how-was-your-hike-today/217487,686,"December 3, 2022"
47,A day of dignity,Living in Taiwan,https://tw.forumosa.com/t/a-day-of-dignity/222474,1050,"August 16, 2022"
48,Funny Pictures 2023,Fun & Games,https://tw.forumosa.com/t/funny-pictures-2023/226383,4050,"January 25, 2023"
49,"""Correct"" pronunciation of my street name?",Learning Chinese,https://tw.forumosa.com/t/correct-pronunciation-of-my-street-name/218651,610,"April 11, 2022"
