,title,category,url,num_views,last_reply_date
0,"Warning for anyone considering using ""Hello Taipei"" to report illegal work activity",Working in Taiwan,https://tw.forumosa.com/t/warning-for-anyone-considering-using-hello-taipei-to-report-illegal-work-activity/207016,2537,"May 23, 2021"
1,2020 : My journey towards getting Taiwanese Citizenship for myself and my infant daughter,Dual Nationality,https://tw.forumosa.com/t/2020-my-journey-towards-getting-taiwanese-citizenship-for-myself-and-my-infant-daughter/200619,2758,"November 30, 2021"
2,Good young people in Taiwan,Living in Taiwan,https://tw.forumosa.com/t/good-young-people-in-taiwan/203329,971,"March 4, 2021"
3,Typhoon Guitar is moving,Business Directory,https://tw.forumosa.com/t/typhoon-guitar-is-moving/211928,689,"September 25, 2021"
4,I Was Accosted By Cops,Living in Taiwan,https://tw.forumosa.com/t/i-was-accosted-by-cops/201695,1956,"January 24, 2021"
5,How Amateur Sleuths Broke the Wuhan Lab Story and Embarrassed the Media,Science & Nature,https://tw.forumosa.com/t/how-amateur-sleuths-broke-the-wuhan-lab-story-and-embarrassed-the-media/208027,4265,"December 2, 2021"
6,Wack Things In Taiwan 2021,Living in Taiwan,https://tw.forumosa.com/t/wack-things-in-taiwan-2021/200851,41957,"December 6, 2021"
7,Is there discrimination here? Is it a concern?,Living in Taiwan,https://tw.forumosa.com/t/is-there-discrimination-here-is-it-a-concern/202504,1789,"February 10, 2021"
8,Left Taiwan for good,Living in Taiwan,https://tw.forumosa.com/t/left-taiwan-for-good/203580,1037,"March 9, 2021"
9,Share your Covid Vaccination Experience Here,Health & Fitness,https://tw.forumosa.com/t/share-your-covid-vaccination-experience-here/210250,5960,"December 7, 2021"
10,Any other Forumosans in a Taiwanese quarantine hotel?,Living in Taiwan,https://tw.forumosa.com/t/any-other-forumosans-in-a-taiwanese-quarantine-hotel/210164,4917,"December 6, 2021"
11,Top-10 things I miss the most about Taiwan that I can’t experience in crappy England,Living in Taiwan,https://tw.forumosa.com/t/top-10-things-i-miss-the-most-about-taiwan-that-i-can-t-experience-in-crappy-england/208302,2184,"July 13, 2021"
12,Cathay General Hospital - Idiots or Anti-foreigners?,Health & Fitness,https://tw.forumosa.com/t/cathay-general-hospital-idiots-or-anti-foreigners/211763,845,"September 11, 2021"
13,Forced to take a COVID test after visiting a hospital for flu,Health & Fitness,https://tw.forumosa.com/t/forced-to-take-a-covid-test-after-visiting-a-hospital-for-flu/207118,976,"May 21, 2021"
14,We are done with Canada (Retirement update),Open Forum,https://tw.forumosa.com/t/we-are-done-with-canada-retirement-update/209185,2328,"October 21, 2021"
15,🆔 New format for ARC/APRC number is not accepted--testing and reporting thread,Living in Taiwan,https://tw.forumosa.com/t/new-format-for-arc-aprc-number-is-not-accepted-testing-and-reporting-thread/200014,10178,"November 13, 2021"
16,The COVID humbug thread,Health & Fitness,https://tw.forumosa.com/t/the-covid-humbug-thread/209238,20398,"December 8, 2021"
17,Any female users on here?,Site Feedback,https://tw.forumosa.com/t/any-female-users-on-here/202179,1464,"February 12, 2021"
18,Taiwan is LOUD (compared to Europe) & drivers can only be as bad as the roads let them,Living in Taiwan,https://tw.forumosa.com/t/taiwan-is-loud-compared-to-europe-drivers-can-only-be-as-bad-as-the-roads-let-them/209100,1763,"July 6, 2021"
19,A Hong Kong Funeral,Open Forum,https://tw.forumosa.com/t/a-hong-kong-funeral/200927,435,"May 25, 2021"
20,Getting the 2nd shot in Taiwan for COVID-19 vaccines,Health & Fitness,https://tw.forumosa.com/t/getting-the-2nd-shot-in-taiwan-for-covid-19-vaccines/208484,12140,"December 6, 2021"
21,Tragic death of a foreign woman. No news coverage,Living in Taiwan,https://tw.forumosa.com/t/tragic-death-of-a-foreign-woman-no-news-coverage/206513,2106,"June 16, 2021"
22,My experience of living in Taiwan as a newcomer,Living in Taiwan,https://tw.forumosa.com/t/my-experience-of-living-in-taiwan-as-a-newcomer/213519,1594,"October 31, 2021"
23,Taiwan : Island of bosses,Living in Taiwan,https://tw.forumosa.com/t/taiwan-island-of-bosses/206332,3433,"June 3, 2021"
24,Info about how to get the Coronavirus Vaccine (Non-discussion thread),Health & Fitness,https://tw.forumosa.com/t/info-about-how-to-get-the-coronavirus-vaccine-non-discussion-thread/208887,3784,"November 18, 2021"
25,BigDave’s weight loss progress,Health & Fitness,https://tw.forumosa.com/t/bigdave-s-weight-loss-progress/208903,2103,"July 21, 2021"
26,Child Needs Year Off from School due to Abuse,General Legal Matters,https://tw.forumosa.com/t/child-needs-year-off-from-school-due-to-abuse/212745,802,"November 2, 2021"
27,Funny Pictures 2021,Fun & Games,https://tw.forumosa.com/t/funny-pictures-2021/200852,37884,"December 7, 2021"
28,They will have to pry Taiwan from my dying hands,Living in Taiwan,https://tw.forumosa.com/t/they-will-have-to-pry-taiwan-from-my-dying-hands/206392,842,"May 9, 2021"
29,"My dear bicycle was stolen tonight, so sad (+police's help) BIKE FOUND",Cycling,https://tw.forumosa.com/t/my-dear-bicycle-was-stolen-tonight-so-sad-polices-help-bike-found/212684,1293,"December 1, 2021"
30,Forced move to Quarantine Center ... how legal is that?,General Legal Matters,https://tw.forumosa.com/t/forced-move-to-quarantine-center-how-legal-is-that/212028,1240,"September 11, 2021"
31,Selected Helpful Posts Related to Covid (May 2021- ),International Travel,https://tw.forumosa.com/t/selected-helpful-posts-related-to-covid-may-2021/207840,2316,"November 23, 2021"
32,Power Plant Shutdown Presidential Alert (13 / 17 May 2021),Living in Taiwan,https://tw.forumosa.com/t/power-plant-shutdown-presidential-alert-13-17-may-2021/206606,3119,"June 1, 2021"
33,My name is white supremacy?,Open Forum,https://tw.forumosa.com/t/my-name-is-white-supremacy/204521,1515,"April 5, 2021"
34,Exploring Taiwanese Indie/Rock Scene,Arts & Entertainment,https://tw.forumosa.com/t/exploring-taiwanese-indie-rock-scene/204838,749,"August 10, 2021"
35,Coronavirus - Taiwan 2021,Living in Taiwan,https://tw.forumosa.com/t/coronavirus-taiwan-2021/200866,74215,"June 1, 2021"
36,Why don’t some of my posts have a heart on?,Site Feedback,https://tw.forumosa.com/t/why-don-t-some-of-my-posts-have-a-heart-on/210035,868,"July 20, 2021"
37,Should foreigners in Taiwan care about Taiwan if Taiwan doesn't care about foreign residents?,Living in Taiwan,https://tw.forumosa.com/t/should-foreigners-in-taiwan-care-about-taiwan-if-taiwan-doesnt-care-about-foreign-residents/209469,5576,"October 8, 2021"
38,Tech workers who flocked to Taiwan’s Covid-free haven are now fleeing,Living in Taiwan,https://tw.forumosa.com/t/tech-workers-who-flocked-to-taiwan-s-covid-free-haven-are-now-fleeing/208029,3409,"October 30, 2021"
39,"How to buy food online during the 2021 Covid-19 outbreak, and after",Food & Drink,https://tw.forumosa.com/t/how-to-buy-food-online-during-the-2021-covid-19-outbreak-and-after/207762,813,"September 7, 2021"
40,Coronavirus Vaccine in Taiwan - May/June 2021,Health & Fitness,https://tw.forumosa.com/t/coronavirus-vaccine-in-taiwan-may-june-2021/206715,30471,"July 1, 2021"
41,Precautions when cycling in Taiwan during COVID,Cycling,https://tw.forumosa.com/t/precautions-when-cycling-in-taiwan-during-covid/206611,3807,"November 2, 2021"
42,Lack of pride for rental landlords,Living in Taiwan,https://tw.forumosa.com/t/lack-of-pride-for-rental-landlords/214338,1776,"December 5, 2021"
43,"John Cena, Apologizing to China",International Politics,https://tw.forumosa.com/t/john-cena-apologizing-to-china/207452,1949,"July 2, 2021"
44,On sexual crimes and false accusations,Open Forum,https://tw.forumosa.com/t/on-sexual-crimes-and-false-accusations/205701,1608,"December 3, 2021"
45,Bad interviews,Working in Taiwan,https://tw.forumosa.com/t/bad-interviews/202352,708,"February 4, 2021"
46,Daily Photos 2021,Living in Taiwan,https://tw.forumosa.com/t/daily-photos-2021/200949,5408,"December 7, 2021"
47,WARNING: APRC Applications Now Require Appointments...in Level 2,Visa & Residency,https://tw.forumosa.com/t/warning-aprc-applications-now-require-appointments-in-level-2/211238,847,"September 17, 2021"
48,Coronavirus - Taiwan OPEN June 2021,Living in Taiwan,https://tw.forumosa.com/t/coronavirus-taiwan-open-june-2021/207874,29913,"July 2, 2021"
49,Cat of the Day 2021,Fun & Games,https://tw.forumosa.com/t/cat-of-the-day-2021/200834,10432,"December 6, 2021"
