,title,category,url,num_views,last_reply_date
0,I Signed - The House Buying Saga,Money,https://tw.forumosa.com/t/i-signed-the-house-buying-saga/216457,5741,"May 23, 2022"
1,I looked into Taiwan’s pension so you don’t have to,Money,https://tw.forumosa.com/t/i-looked-into-taiwan-s-pension-so-you-don-t-have-to/217916,905,"April 1, 2022"
2,Had great fun freezing my ex-employer's assets today,Legal - Work,https://tw.forumosa.com/t/had-great-fun-freezing-my-ex-employers-assets-today/220110,571,"May 26, 2022"
3,Wear a Helmet,Cycling,https://tw.forumosa.com/t/wear-a-helmet/217625,681,"March 9, 2022"
4,I finally got the lathe,Technology,https://tw.forumosa.com/t/i-finally-got-the-lathe/219023,383,"April 26, 2022"
5,Typhoon Guitar is moving,Business Directory,https://tw.forumosa.com/t/typhoon-guitar-is-moving/211928,1163,"December 20, 2021"
6,Share your Covid Vaccination Experience Here,Health & Fitness,https://tw.forumosa.com/t/share-your-covid-vaccination-experience-here/210250,7631,"March 12, 2022"
7,Top-10 things I miss the most about Taiwan that I can’t experience in crappy England,Living in Taiwan,https://tw.forumosa.com/t/top-10-things-i-miss-the-most-about-taiwan-that-i-can-t-experience-in-crappy-england/208302,2543,"July 13, 2021"
8,Any other Forumosans in a Taiwanese quarantine hotel?,Living in Taiwan,https://tw.forumosa.com/t/any-other-forumosans-in-a-taiwanese-quarantine-hotel/210164,11318,"January 21, 2022"
9,Cathay General Hospital - Idiots or Anti-foreigners?,Health & Fitness,https://tw.forumosa.com/t/cathay-general-hospital-idiots-or-anti-foreigners/211763,965,"September 11, 2021"
10,We are done with Canada (Retirement update),Open Forum,https://tw.forumosa.com/t/we-are-done-with-canada-retirement-update/209185,2635,"October 21, 2021"
11,Problems during quarantine,Health & Fitness,https://tw.forumosa.com/t/problems-during-quarantine/216979,1733,"May 18, 2022"
12,Taiwanese stereotypes about foreigners/countries that are actually more true for Taiwan,Living in Taiwan,https://tw.forumosa.com/t/taiwanese-stereotypes-about-foreigners-countries-that-are-actually-more-true-for-taiwan/217442,3315,"March 15, 2022"
13,Personal experiences in the testing/reporting/quarantine process,Living in Taiwan,https://tw.forumosa.com/t/personal-experiences-in-the-testing-reporting-quarantine-process/219553,2567,"June 3, 2022"
14,The COVID humbug thread (2021 edition),Health & Fitness,https://tw.forumosa.com/t/the-covid-humbug-thread-2021-edition/209238,29421,"January 5, 2022"
15,Taiwan is LOUD (compared to Europe) & drivers can only be as bad as the roads let them,Living in Taiwan,https://tw.forumosa.com/t/taiwan-is-loud-compared-to-europe-drivers-can-only-be-as-bad-as-the-roads-let-them/209100,2478,"January 7, 2022"
16,No Public Transport discounts for Foreigners - let's get this fixed,Living in Taiwan,https://tw.forumosa.com/t/no-public-transport-discounts-for-foreigners-lets-get-this-fixed/219859,298,"May 18, 2022"
17,Getting the 2nd shot in Taiwan for COVID-19 vaccines,Health & Fitness,https://tw.forumosa.com/t/getting-the-2nd-shot-in-taiwan-for-covid-19-vaccines/208484,15424,"January 26, 2022"
18,Things you don't see in Taiwan anymore,Living in Taiwan,https://tw.forumosa.com/t/things-you-dont-see-in-taiwan-anymore/215866,2811,"January 29, 2022"
19,A Day in The Life of Ivan Duckedevitch,Living in Taiwan,https://tw.forumosa.com/t/a-day-in-the-life-of-ivan-duckedevitch/215796,555,"January 17, 2022"
20,Coronavirus Taiwan - Specific Developments April 2022,Living in Taiwan,https://tw.forumosa.com/t/coronavirus-taiwan-specific-developments-april-2022/218412,23476,"May 1, 2022"
21,"Scrolling function has issues (Scroll Jank) - was fixed, happening again?",Site Feedback,https://tw.forumosa.com/t/scrolling-function-has-issues-scroll-jank-was-fixed-happening-again/209548,2536,"June 4, 2022"
22,Traditional funeral in Taiwan...some observations,Living in Taiwan,https://tw.forumosa.com/t/traditional-funeral-in-taiwan-some-observations/216674,624,"February 8, 2022"
23,Funny Pictures 2022,Fun & Games,https://tw.forumosa.com/t/funny-pictures-2022/215285,20544,"June 6, 2022"
24,Child Needs Year Off from School due to Abuse,General Legal Matters,https://tw.forumosa.com/t/child-needs-year-off-from-school-due-to-abuse/212745,1033,"November 2, 2021"
25,Info about how to get the Coronavirus Vaccine (Non-discussion thread),Health & Fitness,https://tw.forumosa.com/t/info-about-how-to-get-the-coronavirus-vaccine-non-discussion-thread/208887,4917,"December 28, 2021"
26,High Court orders ex-employer to restore my labor pension account,Legal - Work,https://tw.forumosa.com/t/high-court-orders-ex-employer-to-restore-my-labor-pension-account/218958,371,"April 21, 2022"
27,Wack Things in Taiwan 2022,Living in Taiwan,https://tw.forumosa.com/t/wack-things-in-taiwan-2022/215295,20537,"June 4, 2022"
28,10th Year On Forumosa,Testimonials,https://tw.forumosa.com/t/10th-year-on-forumosa/219513,279,"May 6, 2022"
29,BigDave’s weight loss progress,Health & Fitness,https://tw.forumosa.com/t/bigdave-s-weight-loss-progress/208903,2357,"July 21, 2021"
30,Cat of the Day 2022,Fun & Games,https://tw.forumosa.com/t/cat-of-the-day-2022/215283,5036,"June 5, 2022"
31,How to build a long and successful career in Taiwan as a foreigner,Working in Taiwan,https://tw.forumosa.com/t/how-to-build-a-long-and-successful-career-in-taiwan-as-a-foreigner/210802,864,"August 7, 2021"
32,Lunar New Year 2022,Living in Taiwan,https://tw.forumosa.com/t/lunar-new-year-2022/215824,1987,"February 8, 2022"
33,"My dear bicycle was stolen tonight, so sad (+police's help) BIKE FOUND",Cycling,https://tw.forumosa.com/t/my-dear-bicycle-was-stolen-tonight-so-sad-polices-help-bike-found/212684,1723,"December 1, 2021"
34,Forced move to Quarantine Center ... how legal is that?,General Legal Matters,https://tw.forumosa.com/t/forced-move-to-quarantine-center-how-legal-is-that/212028,1543,"September 11, 2021"
35,Logged out of Forumosa,Site Feedback,https://tw.forumosa.com/t/logged-out-of-forumosa/217571,645,"March 12, 2022"
36,COVID-19 Booster Shots in Taiwan,Health & Fitness,https://tw.forumosa.com/t/covid-19-booster-shots-in-taiwan/214061,9641,"May 9, 2022"
37,Advice on financial aspects in dating a taiwanese woman,Dating & Relationships,https://tw.forumosa.com/t/advice-on-financial-aspects-in-dating-a-taiwanese-woman/217373,2915,"March 13, 2022"
38,Why don’t some of my posts have a heart on?,Site Feedback,https://tw.forumosa.com/t/why-don-t-some-of-my-posts-have-a-heart-on/210035,1443,"July 20, 2021"
39,Lack of pride for rental landlords,Living in Taiwan,https://tw.forumosa.com/t/lack-of-pride-for-rental-landlords/214338,2847,"December 24, 2021"
40,Should foreigners in Taiwan care about Taiwan if Taiwan doesn't care about foreign residents?,Living in Taiwan,https://tw.forumosa.com/t/should-foreigners-in-taiwan-care-about-taiwan-if-taiwan-doesnt-care-about-foreign-residents/209469,6502,"October 8, 2021"
41,"Free pornography, a discussion",Open Forum,https://tw.forumosa.com/t/free-pornography-a-discussion/210051,3475,"February 2, 2022"
42,My experience of living in Taiwan as a newcomer,Living in Taiwan,https://tw.forumosa.com/t/my-experience-of-living-in-taiwan-as-a-newcomer/213519,2068,"October 31, 2021"
43,Survival gardens for small spaces: Good species to grow,Living in Taiwan,https://tw.forumosa.com/t/survival-gardens-for-small-spaces-good-species-to-grow/217898,795,"May 10, 2022"
44,When is the right time to leave,Living in Taiwan,https://tw.forumosa.com/t/when-is-the-right-time-to-leave/215395,7373,"May 11, 2022"
45,WARNING: APRC Applications Now Require Appointments...in Level 2,Visa & Residency,https://tw.forumosa.com/t/warning-aprc-applications-now-require-appointments-in-level-2/211238,1140,"September 17, 2021"
46,I'm a new dad soon! TW-specific Tips?,Parenting,https://tw.forumosa.com/t/im-a-new-dad-soon-tw-specific-tips/214503,1990,"March 6, 2022"
47,Quordle (Wordle x 4),Fun & Games,https://tw.forumosa.com/t/quordle-wordle-x-4/217008,15778,"June 5, 2022"
48,Coronavirus Taiwan - Specific Developments May/June 2022,Living in Taiwan,https://tw.forumosa.com/t/coronavirus-taiwan-specific-developments-may-june-2022/219365,21890,"June 5, 2022"
49,What can be done to help our SEA friends currently suffering,Living in Taiwan,https://tw.forumosa.com/t/what-can-be-done-to-help-our-sea-friends-currently-suffering/208200,6246,"May 5, 2022"
