,title,category,url,num_views,last_reply_date
0,Dragonbones is fighting,Open Forum,https://tw.forumosa.com/t/dragonbones-is-fighting/232900,3652,"September 20, 2023"
1,Going from Taiwan's Gold Card to Taiwanese Citizenship,Visa & Residency,https://tw.forumosa.com/t/going-from-taiwans-gold-card-to-taiwanese-citizenship/223715,2468,"April 2, 2023"
2,I bought a house (+ Taiwan Home Loan Interest Calculator),Legal - Real Estate & Housing,https://tw.forumosa.com/t/i-bought-a-house-taiwan-home-loan-interest-calculator/229203,2776,"September 20, 2023"
3,We moved to Kaohsiung!,Living in Taiwan,https://tw.forumosa.com/t/we-moved-to-kaohsiung/228364,1836,"April 22, 2023"
4,Feeling Disillusioned as an Indian in Taiwan,Living in Taiwan,https://tw.forumosa.com/t/feeling-disillusioned-as-an-indian-in-taiwan/233556,1406,"September 21, 2023"
5,"If You See My Children in Kaohsiung, Tell Them I Love Them!",Legal - Divorce,https://tw.forumosa.com/t/if-you-see-my-children-in-kaohsiung-tell-them-i-love-them/223852,2067,"December 19, 2022"
6,"Happy New Year, Forumosa!",Open Forum,https://tw.forumosa.com/t/happy-new-year-forumosa/226358,592,"January 2, 2023"
7,Anxiety and Depression,Health & Fitness,https://tw.forumosa.com/t/anxiety-and-depression/228479,4422,"July 22, 2023"
8,Stereotypes in Taiwan about other races / nationalities,Living in Taiwan,https://tw.forumosa.com/t/stereotypes-in-taiwan-about-other-races-nationalities/231817,1901,"September 1, 2023"
9,Funny Political Pictures 2023,International Politics,https://tw.forumosa.com/t/funny-political-pictures-2023/226371,25468,"September 22, 2023"
10,Masks: Damaging the Youth of Taiwan,Health & Fitness,https://tw.forumosa.com/t/masks-damaging-the-youth-of-taiwan/233107,2352,"September 12, 2023"
11,Selfish person of the day (in Taiwan),Living in Taiwan,https://tw.forumosa.com/t/selfish-person-of-the-day-in-taiwan/232734,1896,"September 11, 2023"
12,Peak ChaBuDuo thread,Living in Taiwan,https://tw.forumosa.com/t/peak-chabuduo-thread/226131,1092,"December 25, 2022"
13,Taiwan is a xenophobic country. Change my mind,Living in Taiwan,https://tw.forumosa.com/t/taiwan-is-a-xenophobic-country-change-my-mind/223919,6687,"November 9, 2022"
14,Taiwanese driver in New Zealand has rental car revoked within an hour of driving,Cars & Motorcycles,https://tw.forumosa.com/t/taiwanese-driver-in-new-zealand-has-rental-car-revoked-within-an-hour-of-driving/230910,1626,"June 9, 2023"
15,"Taiwan to distribute surplus tax revenue, NT$6,000 to every citizen",Taiwan Politics,https://tw.forumosa.com/t/taiwan-to-distribute-surplus-tax-revenue-nt-6-000-to-every-citizen/226442,13411,"May 29, 2023"
16,Tell us your happy Taiwanese relationship story,Dating & Relationships,https://tw.forumosa.com/t/tell-us-your-happy-taiwanese-relationship-story/225915,2471,"January 29, 2023"
17,2023 WanAn air raid drill (IMPORTANT!),Living in Taiwan,https://tw.forumosa.com/t/2023-wanan-air-raid-drill-important/231693,1541,"July 27, 2023"
18,Funny Pictures 2023,Fun & Games,https://tw.forumosa.com/t/funny-pictures-2023/226383,45925,"September 21, 2023"
19,Dry January and Beyond (Ongoing Accountability group),Food & Drink,https://tw.forumosa.com/t/dry-january-and-beyond-ongoing-accountability-group/226318,11575,"August 30, 2023"
20,Saving Face,Working in Taiwan,https://tw.forumosa.com/t/saving-face/223999,692,"September 30, 2022"
21,Done with living in TW,Living in Taiwan,https://tw.forumosa.com/t/done-with-living-in-tw/233494,1796,"September 21, 2023"
22,A New Low ~ Preschool Suspected of Drugging Pupils,Parenting,https://tw.forumosa.com/t/a-new-low-preschool-suspected-of-drugging-pupils/230969,4516,"August 22, 2023"
23,TSMC’s U.S. Engineers Are “Babies” Say Taiwanese,Working in Taiwan,https://tw.forumosa.com/t/tsmc-s-u-s-engineers-are-babies-say-taiwanese/225101,5768,"August 25, 2023"
24,My new album is out!,Arts & Entertainment,https://tw.forumosa.com/t/my-new-album-is-out/226637,635,"January 15, 2023"
25,Censorship,Site Feedback,https://tw.forumosa.com/t/censorship/228677,965,"March 27, 2023"
26,:hotel: Hotel Booking | Booking.com scams PSA,International Travel,https://tw.forumosa.com/t/hotel-booking-booking-com-scams-psa/231648,394,"July 8, 2023"
27,CTBC Discrimination? Why Foreigners Can't Use Their Cards Properly!,Money,https://tw.forumosa.com/t/ctbc-discrimination-why-foreigners-cant-use-their-cards-properly/231332,862,"July 3, 2023"
28,Finally moving back to Taiwan (Noel update),Living in Taiwan,https://tw.forumosa.com/t/finally-moving-back-to-taiwan-noel-update/232447,557,"August 7, 2023"
29,Cat of the Day 2023,Fun & Games,https://tw.forumosa.com/t/cat-of-the-day-2023/226388,14892,"September 20, 2023"
30,Richart - The first almost/kinda/marginally/minuscularly foreigner friendly bank,Money,https://tw.forumosa.com/t/richart-the-first-almost-kinda-marginally-minuscularly-foreigner-friendly-bank/226485,8986,"August 18, 2023"
31,Got fired for asking my school to use standard international units in their science book,Visa & Residency,https://tw.forumosa.com/t/got-fired-for-asking-my-school-to-use-standard-international-units-in-their-science-book/232562,1334,"August 16, 2023"
32,Life on the MRT 2023,Living in Taiwan,https://tw.forumosa.com/t/life-on-the-mrt-2023/226391,6344,"September 18, 2023"
33,I made an alarm app that teaches you Chinese,Learning Chinese,https://tw.forumosa.com/t/i-made-an-alarm-app-that-teaches-you-chinese/230345,455,"June 1, 2023"
34,Thick coats and flip flops,Living in Taiwan,https://tw.forumosa.com/t/thick-coats-and-flip-flops/226983,902,"January 31, 2023"
35,List of Non-discriminatory Financial Service Providers,Money,https://tw.forumosa.com/t/list-of-non-discriminatory-financial-service-providers/224215,747,"November 17, 2022"
36,China protests / uprisings - the start of Chinese Revolution 3.0? Effects on Taiwan?,Greater Forumosa,https://tw.forumosa.com/t/china-protests-uprisings-the-start-of-chinese-revolution-3-0-effects-on-taiwan/225547,5424,"July 17, 2023"
37,Authentic Italian Restaurants in Taipei Area,Greater Taipei Restaurants,https://tw.forumosa.com/t/authentic-italian-restaurants-in-taipei-area/225324,1515,"February 7, 2023"
38,Trump Indicted! 2023,US Politics,https://tw.forumosa.com/t/trump-indicted-2023/228861,4485,"August 16, 2023"
39,I did the unthinkable (outside of the HVAC trade),Technology,https://tw.forumosa.com/t/i-did-the-unthinkable-outside-of-the-hvac-trade/233021,775,"September 16, 2023"
40,Disrespectful Cousin,Dating & Relationships,https://tw.forumosa.com/t/disrespectful-cousin/231350,986,"August 28, 2023"
41,Death to QR Codes!,Nationwide Restaurants,https://tw.forumosa.com/t/death-to-qr-codes/232700,1319,"September 20, 2023"
42,Taiwanese rechao restaurants,Nationwide Restaurants,https://tw.forumosa.com/t/taiwanese-rechao-restaurants/229918,1468,"May 8, 2023"
43,Alec of Taipei Bike Works - Accident & Road to Recovery,Living in Taiwan,https://tw.forumosa.com/t/alec-of-taipei-bike-works-accident-road-to-recovery/229572,1239,"April 29, 2023"
44,Why are Taiwanese teachers so insistent on teaching English incorrectly?,Teaching English in Taiwan,https://tw.forumosa.com/t/why-are-taiwanese-teachers-so-insistent-on-teaching-english-incorrectly/225925,1522,"January 6, 2023"
45,Foreigners that grew up in Taiwan,Living in Taiwan,https://tw.forumosa.com/t/foreigners-that-grew-up-in-taiwan/228940,3669,"May 2, 2023"
46,"Why are simple things so hard, easycard, einvoice, easy wallet rant",Living in Taiwan,https://tw.forumosa.com/t/why-are-simple-things-so-hard-easycard-einvoice-easy-wallet-rant/227480,842,"August 26, 2023"
47,I fly business class and leave my kid in economy. I get called a 'bad mom',Parenting,https://tw.forumosa.com/t/i-fly-business-class-and-leave-my-kid-in-economy-i-get-called-a-bad-mom/232720,619,"August 18, 2023"
48,Schools for kids with ADHD,Parenting,https://tw.forumosa.com/t/schools-for-kids-with-adhd/228965,1040,"August 18, 2023"
49,Merry Christmas 2022,Open Forum,https://tw.forumosa.com/t/merry-christmas-2022/226217,447,"December 25, 2022"
