,title,category,url,num_views,last_reply_date
0,Jimipresley is heading back home,Open Forum,https://tw.forumosa.com/t/jimipresley-is-heading-back-home/235933,5971,"March 27, 2024"
1,"Farewell, Dragonbones! 💔",Open Forum,https://tw.forumosa.com/t/farewell-dragonbones/232900,7410,"November 5, 2023"
2,Feeling Disillusioned as an Indian in Taiwan,Living in Taiwan,https://tw.forumosa.com/t/feeling-disillusioned-as-an-indian-in-taiwan/233556,5210,"October 6, 2023"
3,Masks: Damaging the Youth of Taiwan,Health & Fitness,https://tw.forumosa.com/t/masks-damaging-the-youth-of-taiwan/233107,4522,"September 29, 2023"
4,Reminiscing about Taiwan. Care to join?,Living in Taiwan,https://tw.forumosa.com/t/reminiscing-about-taiwan-care-to-join/241005,1685,"June 16, 2024"
5,Selfish person of the day (in Taiwan),Living in Taiwan,https://tw.forumosa.com/t/selfish-person-of-the-day-in-taiwan/232734,2853,"May 6, 2024"
6,Congrats on the New Baby!,Living in Taiwan,https://tw.forumosa.com/t/congrats-on-the-new-baby/238881,504,"March 28, 2024"
7,A foreigner’s rant: the agrochemical abyss of rural Taiwan,Living in Taiwan,https://tw.forumosa.com/t/a-foreigner-s-rant-the-agrochemical-abyss-of-rural-taiwan/239033,741,"April 1, 2024"
8,A friend's child getting bullied by their grade school teacher,Parenting,https://tw.forumosa.com/t/a-friends-child-getting-bullied-by-their-grade-school-teacher/234931,1629,"November 8, 2023"
9,Most discrimination in Taiwan boils down to laws/regulations requiring household registration,Discrimination in Taiwan,https://tw.forumosa.com/t/most-discrimination-in-taiwan-boils-down-to-laws-regulations-requiring-household-registration/239715,1188,"May 24, 2024"
10,Don't f-in steal bikes in Taiwan,Cycling,https://tw.forumosa.com/t/dont-f-in-steal-bikes-in-taiwan/238819,1234,"March 30, 2024"
11,Taiwan's Windowless Work Environments,Working in Taiwan,https://tw.forumosa.com/t/taiwans-windowless-work-environments/239260,469,"April 7, 2024"
12,Funny Pictures 2024 :sweat_smile:,Fun & Games,https://tw.forumosa.com/t/funny-pictures-2024/236430,41933,"August 11, 2024"
13,"POPEYES was coming, now it's here!",Nationwide Restaurants,https://tw.forumosa.com/t/popeyes-was-coming-now-its-here/238647,5650,"August 3, 2024"
14,Tell me how long you've been in Taiwan without telling me how long you've been in Taiwan,Fun & Games,https://tw.forumosa.com/t/tell-me-how-long-youve-been-in-taiwan-without-telling-me-how-long-youve-been-in-taiwan/235289,2445,"January 12, 2024"
15,Are administrative appeals against the FSC completely pointless?,General Legal Matters,https://tw.forumosa.com/t/are-administrative-appeals-against-the-fsc-completely-pointless/236737,1233,"May 29, 2024"
16,Happy Lunar New Year 2024,Living in Taiwan,https://tw.forumosa.com/t/happy-lunar-new-year-2024/237646,1190,"March 26, 2024"
17,Finally feeling very settled in Taiwan -- We really love it here -- About time to leave?,Living in Taiwan,https://tw.forumosa.com/t/finally-feeling-very-settled-in-taiwan-we-really-love-it-here-about-time-to-leave/240140,1091,"May 16, 2024"
18,Done with living in TW,Living in Taiwan,https://tw.forumosa.com/t/done-with-living-in-tw/233494,3629,"September 25, 2023"
19,An urgent request - from our beloved forumosan Dragonbones,Health & Fitness,https://tw.forumosa.com/t/an-urgent-request-from-our-beloved-forumosan-dragonbones/233306,1536,"November 6, 2023"
20,Taitung and Thereabouts Thread,Living in Taiwan,https://tw.forumosa.com/t/taitung-and-thereabouts-thread/240336,1047,"July 29, 2024"
21,Death to QR Codes! (Restaurants and Menus),Nationwide Restaurants,https://tw.forumosa.com/t/death-to-qr-codes-restaurants-and-menus/232700,4516,"July 17, 2024"
22,Wack Things in Taiwan 2024,Living in Taiwan,https://tw.forumosa.com/t/wack-things-in-taiwan-2024/236466,23687,"August 11, 2024"
23,Funny Political Pictures 2024 :smirk:,International Politics,https://tw.forumosa.com/t/funny-political-pictures-2024/236431,27353,"August 11, 2024"
24,Time to visit gov offices and banks and telcos,Money,https://tw.forumosa.com/t/time-to-visit-gov-offices-and-banks-and-telcos/234348,3775,"December 31, 2023"
25,The Last Days of Sanity: Madness in the Cram School - A Teacher's Tale,Teaching English in Taiwan,https://tw.forumosa.com/t/the-last-days-of-sanity-madness-in-the-cram-school-a-teachers-tale/238637,1965,"March 31, 2024"
26,Got fired for asking my school to use standard international units in their science book,Visa & Residency,https://tw.forumosa.com/t/got-fired-for-asking-my-school-to-use-standard-international-units-in-their-science-book/232562,1997,"August 16, 2023"
27,Non-legal aspects regarding advantages of having Taiwan Citizenship,Living in Taiwan,https://tw.forumosa.com/t/non-legal-aspects-regarding-advantages-of-having-taiwan-citizenship/235288,1353,"December 10, 2023"
28,Foreigners Behaving Badly in Taiwan,Living in Taiwan,https://tw.forumosa.com/t/foreigners-behaving-badly-in-taiwan/238666,6371,"June 11, 2024"
29,Taking action against Taiwan's definition of domicile/residence relating to foreigners,Discrimination in Taiwan,https://tw.forumosa.com/t/taking-action-against-taiwans-definition-of-domicile-residence-relating-to-foreigners/236419,6364,"July 31, 2024"
30,I did the unthinkable (outside of the HVAC trade),Technology,https://tw.forumosa.com/t/i-did-the-unthinkable-outside-of-the-hvac-trade/233021,1157,"September 16, 2023"
31,YouTuber's Experience Buying a House in Taiwan,Money,https://tw.forumosa.com/t/youtubers-experience-buying-a-house-in-taiwan/234028,683,"October 6, 2023"
32,Taipei Polam Kopitiam (Xinyi branch) food poisoning,Greater Taipei Restaurants,https://tw.forumosa.com/t/taipei-polam-kopitiam-xinyi-branch-food-poisoning/238904,3576,"July 16, 2024"
33,What is it actually like to become Taiwanese?,Living in Taiwan,https://tw.forumosa.com/t/what-is-it-actually-like-to-become-taiwanese/239036,2226,"April 24, 2024"
34,Have any foreigners opened a bank account without using their passport?,Discrimination in Taiwan,https://tw.forumosa.com/t/have-any-foreigners-opened-a-bank-account-without-using-their-passport/236622,1005,"April 3, 2024"
35,I fly business class and leave my kid in economy. I get called a 'bad mom',Parenting,https://tw.forumosa.com/t/i-fly-business-class-and-leave-my-kid-in-economy-i-get-called-a-bad-mom/232720,1160,"August 18, 2023"
36,Noel's new Taiwan YouTube channel,YouTube & Other Video Clips,https://tw.forumosa.com/t/noels-new-taiwan-youtube-channel/235851,966,"May 3, 2024"
37,Foreigner assaults taxi driver - government connections make it go away,Living in Taiwan,https://tw.forumosa.com/t/foreigner-assaults-taxi-driver-government-connections-make-it-go-away/234279,2593,"October 21, 2023"
38,Banking rant (traveling outside of Taiwan),Money,https://tw.forumosa.com/t/banking-rant-traveling-outside-of-taiwan/237280,575,"January 29, 2024"
39,Which digital banks in Taiwan refuse to provide services to foreigners?,Discrimination in Taiwan,https://tw.forumosa.com/t/which-digital-banks-in-taiwan-refuse-to-provide-services-to-foreigners/237638,687,"April 2, 2024"
40,Insecurity about my appearance in Taiwan,Dating & Relationships,https://tw.forumosa.com/t/insecurity-about-my-appearance-in-taiwan/239479,2721,"June 2, 2024"
41,Busybody amahs,Parenting,https://tw.forumosa.com/t/busybody-amahs/242794,445,"August 9, 2024"
42,Destitute travellers,Living in Taiwan,https://tw.forumosa.com/t/destitute-travellers/242493,1094,"August 4, 2024"
43,What Citizenships can I Buy?,Open Forum,https://tw.forumosa.com/t/what-citizenships-can-i-buy/233830,1434,"October 20, 2023"
44,Strange interaction I had with a Taiwanese person,Living in Taiwan,https://tw.forumosa.com/t/strange-interaction-i-had-with-a-taiwanese-person/232644,852,"August 25, 2023"
45,Air Raid Alert - Rocket Flyover - Not a Drill,Taiwan Politics,https://tw.forumosa.com/t/air-raid-alert-rocket-flyover-not-a-drill/236685,3393,"June 26, 2024"
46,Cat of the Day 2024 :cat:,Fun & Games,https://tw.forumosa.com/t/cat-of-the-day-2024/236456,7733,"August 11, 2024"
47,"Just moved to Pingzhen (平鎮) from the US, would like some advice on meeting people",Dating & Relationships,https://tw.forumosa.com/t/just-moved-to-pingzhen-from-the-us-would-like-some-advice-on-meeting-people/233262,2076,"April 2, 2024"
48,Panic attacks,Health & Fitness,https://tw.forumosa.com/t/panic-attacks/233484,732,"September 18, 2023"
49,Earthquakes 2024,Living in Taiwan,https://tw.forumosa.com/t/earthquakes-2024/236454,22279,"August 11, 2024"
