,title,category,url,num_views,last_reply_date
0,"Warning for anyone considering using ""Hello Taipei"" to report illegal work activity",Working in Taiwan,https://tw.forumosa.com/t/warning-for-anyone-considering-using-hello-taipei-to-report-illegal-work-activity/207016,2727,"May 23, 2021"
1,I Signed (to buy a house),Money,https://tw.forumosa.com/t/i-signed-to-buy-a-house/216457,2902,"March 1, 2022"
2,Wear a Helmet,Cycling,https://tw.forumosa.com/t/wear-a-helmet/217625,531,"March 9, 2022"
3,How Amateur Sleuths Broke the Wuhan Lab Story and Embarrassed the Media,Science & Nature,https://tw.forumosa.com/t/how-amateur-sleuths-broke-the-wuhan-lab-story-and-embarrassed-the-media/208027,5310,"January 13, 2022"
4,Typhoon Guitar is moving,Business Directory,https://tw.forumosa.com/t/typhoon-guitar-is-moving/211928,1047,"December 20, 2021"
5,Share your Covid Vaccination Experience Here,Health & Fitness,https://tw.forumosa.com/t/share-your-covid-vaccination-experience-here/210250,6974,"March 12, 2022"
6,Top-10 things I miss the most about Taiwan that I can’t experience in crappy England,Living in Taiwan,https://tw.forumosa.com/t/top-10-things-i-miss-the-most-about-taiwan-that-i-can-t-experience-in-crappy-england/208302,2365,"July 13, 2021"
7,Any other Forumosans in a Taiwanese quarantine hotel?,Living in Taiwan,https://tw.forumosa.com/t/any-other-forumosans-in-a-taiwanese-quarantine-hotel/210164,10335,"January 21, 2022"
8,Cathay General Hospital - Idiots or Anti-foreigners?,Health & Fitness,https://tw.forumosa.com/t/cathay-general-hospital-idiots-or-anti-foreigners/211763,923,"September 11, 2021"
9,Forced to take a COVID test after visiting a hospital for flu,Health & Fitness,https://tw.forumosa.com/t/forced-to-take-a-covid-test-after-visiting-a-hospital-for-flu/207118,1096,"May 21, 2021"
10,We are done with Canada (Retirement update),Open Forum,https://tw.forumosa.com/t/we-are-done-with-canada-retirement-update/209185,2481,"October 21, 2021"
11,Taiwanese stereotypes about foreigners/countries that are actually more true for Taiwan,Living in Taiwan,https://tw.forumosa.com/t/taiwanese-stereotypes-about-foreigners-countries-that-are-actually-more-true-for-taiwan/217442,2633,"March 15, 2022"
12,The COVID humbug thread (2021 edition),Health & Fitness,https://tw.forumosa.com/t/the-covid-humbug-thread-2021-edition/209238,26218,"January 5, 2022"
13,Taiwan is LOUD (compared to Europe) & drivers can only be as bad as the roads let them,Living in Taiwan,https://tw.forumosa.com/t/taiwan-is-loud-compared-to-europe-drivers-can-only-be-as-bad-as-the-roads-let-them/209100,2187,"January 7, 2022"
14,Getting the 2nd shot in Taiwan for COVID-19 vaccines,Health & Fitness,https://tw.forumosa.com/t/getting-the-2nd-shot-in-taiwan-for-covid-19-vaccines/208484,14085,"January 26, 2022"
15,Things you don't see in Taiwan anymore,Living in Taiwan,https://tw.forumosa.com/t/things-you-dont-see-in-taiwan-anymore/215866,2406,"January 29, 2022"
16,A Day in The Life of Ivan Duckedevitch,Living in Taiwan,https://tw.forumosa.com/t/a-day-in-the-life-of-ivan-duckedevitch/215796,508,"January 17, 2022"
17,Tragic death of a foreign woman. No news coverage,Living in Taiwan,https://tw.forumosa.com/t/tragic-death-of-a-foreign-woman-no-news-coverage/206513,2294,"June 16, 2021"
18,They will have to pry Taiwan from my dying hands,Living in Taiwan,https://tw.forumosa.com/t/they-will-have-to-pry-taiwan-from-my-dying-hands/206392,1289,"February 27, 2022"
19,Traditional funeral in Taiwan...some observations,Living in Taiwan,https://tw.forumosa.com/t/traditional-funeral-in-taiwan-some-observations/216674,528,"February 8, 2022"
20,Child Needs Year Off from School due to Abuse,General Legal Matters,https://tw.forumosa.com/t/child-needs-year-off-from-school-due-to-abuse/212745,945,"November 2, 2021"
21,Scrolling function has issues (Scroll Jank) - Workaround found,Site Feedback,https://tw.forumosa.com/t/scrolling-function-has-issues-scroll-jank-workaround-found/209548,1984,"March 15, 2022"
22,Problems during quarantine,Health & Fitness,https://tw.forumosa.com/t/problems-during-quarantine/216979,1063,"February 19, 2022"
23,Info about how to get the Coronavirus Vaccine (Non-discussion thread),Health & Fitness,https://tw.forumosa.com/t/info-about-how-to-get-the-coronavirus-vaccine-non-discussion-thread/208887,4424,"December 28, 2021"
24,Taiwan : Island of bosses,Living in Taiwan,https://tw.forumosa.com/t/taiwan-island-of-bosses/206332,3763,"June 3, 2021"
25,BigDave’s weight loss progress,Health & Fitness,https://tw.forumosa.com/t/bigdave-s-weight-loss-progress/208903,2230,"July 21, 2021"
26,How to build a long and successful career in Taiwan as a foreigner,Working in Taiwan,https://tw.forumosa.com/t/how-to-build-a-long-and-successful-career-in-taiwan-as-a-foreigner/210802,808,"August 7, 2021"
27,Funny Pictures 2022,Fun & Games,https://tw.forumosa.com/t/funny-pictures-2022/215285,8083,"March 15, 2022"
28,Lunar New Year 2022,Living in Taiwan,https://tw.forumosa.com/t/lunar-new-year-2022/215824,1678,"February 8, 2022"
29,"My dear bicycle was stolen tonight, so sad (+police's help) BIKE FOUND",Cycling,https://tw.forumosa.com/t/my-dear-bicycle-was-stolen-tonight-so-sad-polices-help-bike-found/212684,1511,"December 1, 2021"
30,Selected Helpful Posts Related to Covid (May 2021- ),International Travel,https://tw.forumosa.com/t/selected-helpful-posts-related-to-covid-may-2021/207840,3029,"November 23, 2021"
31,Forced move to Quarantine Center ... how legal is that?,General Legal Matters,https://tw.forumosa.com/t/forced-move-to-quarantine-center-how-legal-is-that/212028,1410,"September 11, 2021"
32,"Taiwan Tattoo, My New Book",Open Forum,https://tw.forumosa.com/t/taiwan-tattoo-my-new-book/216925,6567,"March 15, 2022"
33,Logged out of Forumosa,Site Feedback,https://tw.forumosa.com/t/logged-out-of-forumosa/217571,495,"March 12, 2022"
34,Power Plant Shutdown Presidential Alert (13 / 17 May 2021),Living in Taiwan,https://tw.forumosa.com/t/power-plant-shutdown-presidential-alert-13-17-may-2021/206606,3543,"June 1, 2021"
35,My name is white supremacy?,Open Forum,https://tw.forumosa.com/t/my-name-is-white-supremacy/204521,1719,"April 5, 2021"
36,Why don’t some of my posts have a heart on?,Site Feedback,https://tw.forumosa.com/t/why-don-t-some-of-my-posts-have-a-heart-on/210035,1287,"July 20, 2021"
37,Exploring Taiwanese Indie/Rock Scene,Arts & Entertainment,https://tw.forumosa.com/t/exploring-taiwanese-indie-rock-scene/204838,885,"August 10, 2021"
38,Advice on financial aspects in dating a taiwanese woman,Dating & Relationships,https://tw.forumosa.com/t/advice-on-financial-aspects-in-dating-a-taiwanese-woman/217373,2297,"March 13, 2022"
39,COVID-19 Booster Shots in Taiwan,Health & Fitness,https://tw.forumosa.com/t/covid-19-booster-shots-in-taiwan/214061,7115,"March 15, 2022"
40,"How to buy food online during the 2021 Covid-19 outbreak, and after",Food & Drink,https://tw.forumosa.com/t/how-to-buy-food-online-during-the-2021-covid-19-outbreak-and-after/207762,937,"September 7, 2021"
41,Should foreigners in Taiwan care about Taiwan if Taiwan doesn't care about foreign residents?,Living in Taiwan,https://tw.forumosa.com/t/should-foreigners-in-taiwan-care-about-taiwan-if-taiwan-doesnt-care-about-foreign-residents/209469,6072,"October 8, 2021"
42,Lack of pride for rental landlords,Living in Taiwan,https://tw.forumosa.com/t/lack-of-pride-for-rental-landlords/214338,2581,"December 24, 2021"
43,Tech workers who flocked to Taiwan’s Covid-free haven are now fleeing,Living in Taiwan,https://tw.forumosa.com/t/tech-workers-who-flocked-to-taiwan-s-covid-free-haven-are-now-fleeing/208029,3686,"October 30, 2021"
44,Precautions when cycling in Taiwan during COVID,Cycling,https://tw.forumosa.com/t/precautions-when-cycling-in-taiwan-during-covid/206611,4187,"November 2, 2021"
45,Coronavirus Vaccine in Taiwan - May/June 2021,Health & Fitness,https://tw.forumosa.com/t/coronavirus-vaccine-in-taiwan-may-june-2021/206715,33738,"July 1, 2021"
46,Cat of the Day 2022,Fun & Games,https://tw.forumosa.com/t/cat-of-the-day-2022/215283,2289,"March 15, 2022"
47,"John Cena, Apologizing to China",International Politics,https://tw.forumosa.com/t/john-cena-apologizing-to-china/207452,2366,"July 2, 2021"
48,"Free pornography, a discussion",Open Forum,https://tw.forumosa.com/t/free-pornography-a-discussion/210051,3066,"February 2, 2022"
49,My experience of living in Taiwan as a newcomer,Living in Taiwan,https://tw.forumosa.com/t/my-experience-of-living-in-taiwan-as-a-newcomer/213519,1861,"October 31, 2021"
