,title,category,url,num_views,last_reply_date
0,"Warning for anyone considering using ""Hello Taipei"" to report illegal work activity",Working in Taiwan,https://tw.forumosa.com/t/warning-for-anyone-considering-using-hello-taipei-to-report-illegal-work-activity/207016,2662,"May 23, 2021"
1,Good young people in Taiwan,Living in Taiwan,https://tw.forumosa.com/t/good-young-people-in-taiwan/203329,1029,"March 4, 2021"
2,I Signed (to buy a house),Money,https://tw.forumosa.com/t/i-signed-to-buy-a-house/216457,821,"February 1, 2022"
3,How Amateur Sleuths Broke the Wuhan Lab Story and Embarrassed the Media,Science & Nature,https://tw.forumosa.com/t/how-amateur-sleuths-broke-the-wuhan-lab-story-and-embarrassed-the-media/208027,5031,"January 13, 2022"
4,Typhoon Guitar is moving,Business Directory,https://tw.forumosa.com/t/typhoon-guitar-is-moving/211928,1005,"December 20, 2021"
5,Is there discrimination here? Is it a concern?,Living in Taiwan,https://tw.forumosa.com/t/is-there-discrimination-here-is-it-a-concern/202504,1947,"February 10, 2021"
6,Left Taiwan for good,Living in Taiwan,https://tw.forumosa.com/t/left-taiwan-for-good/203580,1076,"March 9, 2021"
7,Share your Covid Vaccination Experience Here,Health & Fitness,https://tw.forumosa.com/t/share-your-covid-vaccination-experience-here/210250,6432,"December 7, 2021"
8,Top-10 things I miss the most about Taiwan that I can’t experience in crappy England,Living in Taiwan,https://tw.forumosa.com/t/top-10-things-i-miss-the-most-about-taiwan-that-i-can-t-experience-in-crappy-england/208302,2286,"July 13, 2021"
9,Any other Forumosans in a Taiwanese quarantine hotel?,Living in Taiwan,https://tw.forumosa.com/t/any-other-forumosans-in-a-taiwanese-quarantine-hotel/210164,9795,"January 21, 2022"
10,Cathay General Hospital - Idiots or Anti-foreigners?,Health & Fitness,https://tw.forumosa.com/t/cathay-general-hospital-idiots-or-anti-foreigners/211763,895,"September 11, 2021"
11,Forced to take a COVID test after visiting a hospital for flu,Health & Fitness,https://tw.forumosa.com/t/forced-to-take-a-covid-test-after-visiting-a-hospital-for-flu/207118,1051,"May 21, 2021"
12,We are done with Canada (Retirement update),Open Forum,https://tw.forumosa.com/t/we-are-done-with-canada-retirement-update/209185,2423,"October 21, 2021"
13,The COVID humbug thread (2021 edition),Health & Fitness,https://tw.forumosa.com/t/the-covid-humbug-thread-2021-edition/209238,24734,"January 5, 2022"
14,Taiwan is LOUD (compared to Europe) & drivers can only be as bad as the roads let them,Living in Taiwan,https://tw.forumosa.com/t/taiwan-is-loud-compared-to-europe-drivers-can-only-be-as-bad-as-the-roads-let-them/209100,2020,"January 7, 2022"
15,Getting the 2nd shot in Taiwan for COVID-19 vaccines,Health & Fitness,https://tw.forumosa.com/t/getting-the-2nd-shot-in-taiwan-for-covid-19-vaccines/208484,13440,"January 26, 2022"
16,Things you don't see in Taiwan anymore,Living in Taiwan,https://tw.forumosa.com/t/things-you-dont-see-in-taiwan-anymore/215866,2176,"January 29, 2022"
17,A Day in The Life of Ivan Duckedevitch,Living in Taiwan,https://tw.forumosa.com/t/a-day-in-the-life-of-ivan-duckedevitch/215796,475,"January 17, 2022"
18,Tragic death of a foreign woman. No news coverage,Living in Taiwan,https://tw.forumosa.com/t/tragic-death-of-a-foreign-woman-no-news-coverage/206513,2209,"June 16, 2021"
19,My experience of living in Taiwan as a newcomer,Living in Taiwan,https://tw.forumosa.com/t/my-experience-of-living-in-taiwan-as-a-newcomer/213519,1804,"October 31, 2021"
20,Child Needs Year Off from School due to Abuse,General Legal Matters,https://tw.forumosa.com/t/child-needs-year-off-from-school-due-to-abuse/212745,890,"November 2, 2021"
21,Scrolling function has issues (Scroll Jank),Site Feedback,https://tw.forumosa.com/t/scrolling-function-has-issues-scroll-jank/209548,1781,"January 27, 2022"
22,Info about how to get the Coronavirus Vaccine (Non-discussion thread),Health & Fitness,https://tw.forumosa.com/t/info-about-how-to-get-the-coronavirus-vaccine-non-discussion-thread/208887,4175,"December 28, 2021"
23,Taiwan : Island of bosses,Living in Taiwan,https://tw.forumosa.com/t/taiwan-island-of-bosses/206332,3626,"June 3, 2021"
24,BigDave’s weight loss progress,Health & Fitness,https://tw.forumosa.com/t/bigdave-s-weight-loss-progress/208903,2174,"July 21, 2021"
25,Lunar New Year 2022,Living in Taiwan,https://tw.forumosa.com/t/lunar-new-year-2022/215824,742,"February 1, 2022"
26,They will have to pry Taiwan from my dying hands,Living in Taiwan,https://tw.forumosa.com/t/they-will-have-to-pry-taiwan-from-my-dying-hands/206392,868,"May 9, 2021"
27,How to build a long and successful career in Taiwan as a foreigner,Working in Taiwan,https://tw.forumosa.com/t/how-to-build-a-long-and-successful-career-in-taiwan-as-a-foreigner/210802,783,"August 7, 2021"
28,"My dear bicycle was stolen tonight, so sad (+police's help) BIKE FOUND",Cycling,https://tw.forumosa.com/t/my-dear-bicycle-was-stolen-tonight-so-sad-polices-help-bike-found/212684,1422,"December 1, 2021"
29,Forced move to Quarantine Center ... how legal is that?,General Legal Matters,https://tw.forumosa.com/t/forced-move-to-quarantine-center-how-legal-is-that/212028,1345,"September 11, 2021"
30,Selected Helpful Posts Related to Covid (May 2021- ),International Travel,https://tw.forumosa.com/t/selected-helpful-posts-related-to-covid-may-2021/207840,2708,"November 23, 2021"
31,Power Plant Shutdown Presidential Alert (13 / 17 May 2021),Living in Taiwan,https://tw.forumosa.com/t/power-plant-shutdown-presidential-alert-13-17-may-2021/206606,3359,"June 1, 2021"
32,My name is white supremacy?,Open Forum,https://tw.forumosa.com/t/my-name-is-white-supremacy/204521,1629,"April 5, 2021"
33,Why don’t some of my posts have a heart on?,Site Feedback,https://tw.forumosa.com/t/why-don-t-some-of-my-posts-have-a-heart-on/210035,1149,"July 20, 2021"
34,Exploring Taiwanese Indie/Rock Scene,Arts & Entertainment,https://tw.forumosa.com/t/exploring-taiwanese-indie-rock-scene/204838,829,"August 10, 2021"
35,"How to buy food online during the 2021 Covid-19 outbreak, and after",Food & Drink,https://tw.forumosa.com/t/how-to-buy-food-online-during-the-2021-covid-19-outbreak-and-after/207762,882,"September 7, 2021"
36,Should foreigners in Taiwan care about Taiwan if Taiwan doesn't care about foreign residents?,Living in Taiwan,https://tw.forumosa.com/t/should-foreigners-in-taiwan-care-about-taiwan-if-taiwan-doesnt-care-about-foreign-residents/209469,5864,"October 8, 2021"
37,Tech workers who flocked to Taiwan’s Covid-free haven are now fleeing,Living in Taiwan,https://tw.forumosa.com/t/tech-workers-who-flocked-to-taiwan-s-covid-free-haven-are-now-fleeing/208029,3586,"October 30, 2021"
38,Lack of pride for rental landlords,Living in Taiwan,https://tw.forumosa.com/t/lack-of-pride-for-rental-landlords/214338,2367,"December 24, 2021"
39,COVID-19 Booster Shots in Taiwan,Health & Fitness,https://tw.forumosa.com/t/covid-19-booster-shots-in-taiwan/214061,5834,"January 31, 2022"
40,Precautions when cycling in Taiwan during COVID,Cycling,https://tw.forumosa.com/t/precautions-when-cycling-in-taiwan-during-covid/206611,3994,"November 2, 2021"
41,Coronavirus Vaccine in Taiwan - May/June 2021,Health & Fitness,https://tw.forumosa.com/t/coronavirus-vaccine-in-taiwan-may-june-2021/206715,32246,"July 1, 2021"
42,"John Cena, Apologizing to China",International Politics,https://tw.forumosa.com/t/john-cena-apologizing-to-china/207452,2214,"July 2, 2021"
43,Audrey Tang 唐鳳 Taiwan’s Digital Minister,Taiwan Politics,https://tw.forumosa.com/t/audrey-tang-taiwan-s-digital-minister/206828,1561,"December 13, 2021"
44,Funny Pictures 2022,Fun & Games,https://tw.forumosa.com/t/funny-pictures-2022/215285,3573,"February 1, 2022"
45,On sexual crimes and false accusations,Open Forum,https://tw.forumosa.com/t/on-sexual-crimes-and-false-accusations/205701,1792,"December 3, 2021"
46,Bad interviews,Working in Taiwan,https://tw.forumosa.com/t/bad-interviews/202352,730,"February 4, 2021"
47,WARNING: APRC Applications Now Require Appointments...in Level 2,Visa & Residency,https://tw.forumosa.com/t/warning-aprc-applications-now-require-appointments-in-level-2/211238,934,"September 17, 2021"
48,Coronavirus - Taiwan OPEN June 2021,Living in Taiwan,https://tw.forumosa.com/t/coronavirus-taiwan-open-june-2021/207874,31286,"July 2, 2021"
49,"Free pornography, a discussion",Open Forum,https://tw.forumosa.com/t/free-pornography-a-discussion/210051,2738,"January 27, 2022"
