,title,category,url,num_views,last_reply_date
0,Dragonbones is fighting,Open Forum,https://tw.forumosa.com/t/dragonbones-is-fighting/232900,2110,"September 7, 2023"
1,Going from Taiwan's Gold Card to Taiwanese Citizenship,Visa & Residency,https://tw.forumosa.com/t/going-from-taiwans-gold-card-to-taiwanese-citizenship/223715,2423,"April 2, 2023"
2,I bought a house (+ Taiwan Home Loan Interest Calculator),Legal - Real Estate & Housing,https://tw.forumosa.com/t/i-bought-a-house-taiwan-home-loan-interest-calculator/229203,2543,"August 22, 2023"
3,We moved to Kaohsiung!,Living in Taiwan,https://tw.forumosa.com/t/we-moved-to-kaohsiung/228364,1802,"April 22, 2023"
4,"If You See My Children in Kaohsiung, Tell Them I Love Them!",Legal - Divorce,https://tw.forumosa.com/t/if-you-see-my-children-in-kaohsiung-tell-them-i-love-them/223852,2041,"December 19, 2022"
5,"Happy New Year, Forumosa!",Open Forum,https://tw.forumosa.com/t/happy-new-year-forumosa/226358,587,"January 2, 2023"
6,Anxiety and Depression,Health & Fitness,https://tw.forumosa.com/t/anxiety-and-depression/228479,4364,"July 22, 2023"
7,Stereotypes in Taiwan about other races / nationalities,Living in Taiwan,https://tw.forumosa.com/t/stereotypes-in-taiwan-about-other-races-nationalities/231817,1851,"September 1, 2023"
8,Funny Political Pictures 2023,International Politics,https://tw.forumosa.com/t/funny-political-pictures-2023/226371,24130,"September 8, 2023"
9,Masks: Damaging the Youth of Taiwan,Parenting,https://tw.forumosa.com/t/masks-damaging-the-youth-of-taiwan/233107,1425,"September 7, 2023"
10,Selfish person of the day (in Taiwan),Living in Taiwan,https://tw.forumosa.com/t/selfish-person-of-the-day-in-taiwan/232734,1590,"September 4, 2023"
11,Peak ChaBuDuo thread,Living in Taiwan,https://tw.forumosa.com/t/peak-chabuduo-thread/226131,1077,"December 25, 2022"
12,Taiwan is a xenophobic country. Change my mind,Living in Taiwan,https://tw.forumosa.com/t/taiwan-is-a-xenophobic-country-change-my-mind/223919,6599,"November 9, 2022"
13,Taiwanese driver in New Zealand has rental car revoked within an hour of driving,Cars & Motorcycles,https://tw.forumosa.com/t/taiwanese-driver-in-new-zealand-has-rental-car-revoked-within-an-hour-of-driving/230910,1582,"June 9, 2023"
14,"Taiwan to distribute surplus tax revenue, NT$6,000 to every citizen",Taiwan Politics,https://tw.forumosa.com/t/taiwan-to-distribute-surplus-tax-revenue-nt-6-000-to-every-citizen/226442,13243,"May 29, 2023"
15,Tell us your happy Taiwanese relationship story,Dating & Relationships,https://tw.forumosa.com/t/tell-us-your-happy-taiwanese-relationship-story/225915,2443,"January 29, 2023"
16,2023 WanAn air raid drill (IMPORTANT!),Living in Taiwan,https://tw.forumosa.com/t/2023-wanan-air-raid-drill-important/231693,1521,"July 27, 2023"
17,Funny Pictures 2023,Fun & Games,https://tw.forumosa.com/t/funny-pictures-2023/226383,43110,"September 8, 2023"
18,Dry January and Beyond (Ongoing Accountability group),Food & Drink,https://tw.forumosa.com/t/dry-january-and-beyond-ongoing-accountability-group/226318,11449,"August 30, 2023"
19,Saving Face,Working in Taiwan,https://tw.forumosa.com/t/saving-face/223999,685,"September 30, 2022"
20,A New Low ~ Preschool Suspected of Drugging Pupils,Parenting,https://tw.forumosa.com/t/a-new-low-preschool-suspected-of-drugging-pupils/230969,4426,"August 22, 2023"
21,TSMC’s U.S. Engineers Are “Babies” Say Taiwanese,Working in Taiwan,https://tw.forumosa.com/t/tsmc-s-u-s-engineers-are-babies-say-taiwanese/225101,5699,"August 25, 2023"
22,My new album is out!,Arts & Entertainment,https://tw.forumosa.com/t/my-new-album-is-out/226637,617,"January 15, 2023"
23,Censorship,Site Feedback,https://tw.forumosa.com/t/censorship/228677,930,"March 27, 2023"
24,:hotel: Hotel Booking | Booking.com scams PSA,International Travel,https://tw.forumosa.com/t/hotel-booking-booking-com-scams-psa/231648,382,"July 8, 2023"
25,CTBC Discrimination? Why Foreigners Can't Use Their Cards Properly!,Money,https://tw.forumosa.com/t/ctbc-discrimination-why-foreigners-cant-use-their-cards-properly/231332,832,"July 3, 2023"
26,Finally moving back to Taiwan (Noel update),Living in Taiwan,https://tw.forumosa.com/t/finally-moving-back-to-taiwan-noel-update/232447,547,"August 7, 2023"
27,Richart - The first almost/kinda/marginally/minuscularly foreigner friendly bank,Money,https://tw.forumosa.com/t/richart-the-first-almost-kinda-marginally-minuscularly-foreigner-friendly-bank/226485,8854,"August 18, 2023"
28,Got fired for asking my school to use standard international units in their science book,Visa & Residency,https://tw.forumosa.com/t/got-fired-for-asking-my-school-to-use-standard-international-units-in-their-science-book/232562,1291,"August 16, 2023"
29,Life on the MRT 2023,Living in Taiwan,https://tw.forumosa.com/t/life-on-the-mrt-2023/226391,5887,"September 6, 2023"
30,I made an alarm app that teaches you Chinese,Learning Chinese,https://tw.forumosa.com/t/i-made-an-alarm-app-that-teaches-you-chinese/230345,446,"June 1, 2023"
31,Thick coats and flip flops,Living in Taiwan,https://tw.forumosa.com/t/thick-coats-and-flip-flops/226983,895,"January 31, 2023"
32,Cat of the Day 2023,Fun & Games,https://tw.forumosa.com/t/cat-of-the-day-2023/226388,14234,"September 7, 2023"
33,List of Non-discriminatory Financial Service Providers,Money,https://tw.forumosa.com/t/list-of-non-discriminatory-financial-service-providers/224215,739,"November 17, 2022"
34,China protests / uprisings - the start of Chinese Revolution 3.0? Effects on Taiwan?,Greater Forumosa,https://tw.forumosa.com/t/china-protests-uprisings-the-start-of-chinese-revolution-3-0-effects-on-taiwan/225547,5378,"July 17, 2023"
35,Authentic Italian Restaurants in Taipei Area,Greater Taipei Restaurants,https://tw.forumosa.com/t/authentic-italian-restaurants-in-taipei-area/225324,1479,"February 7, 2023"
36,Trump Indicted! 2023,US Politics,https://tw.forumosa.com/t/trump-indicted-2023/228861,4411,"August 16, 2023"
37,Disrespectful Cousin,Dating & Relationships,https://tw.forumosa.com/t/disrespectful-cousin/231350,973,"August 28, 2023"
38,Alec of Taipei Bike Works - Accident & Road to Recovery,Living in Taiwan,https://tw.forumosa.com/t/alec-of-taipei-bike-works-accident-road-to-recovery/229572,1224,"April 29, 2023"
39,Taiwanese rechao restaurants,Nationwide Restaurants,https://tw.forumosa.com/t/taiwanese-rechao-restaurants/229918,1397,"May 8, 2023"
40,Death to QR Codes!,Nationwide Restaurants,https://tw.forumosa.com/t/death-to-qr-codes/232700,1199,"September 7, 2023"
41,Why are Taiwanese teachers so insistent on teaching English incorrectly?,Teaching English in Taiwan,https://tw.forumosa.com/t/why-are-taiwanese-teachers-so-insistent-on-teaching-english-incorrectly/225925,1511,"January 6, 2023"
42,Foreigners that grew up in Taiwan,Living in Taiwan,https://tw.forumosa.com/t/foreigners-that-grew-up-in-taiwan/228940,3634,"May 2, 2023"
43,"Why are simple things so hard, easycard, einvoice, easy wallet rant",Living in Taiwan,https://tw.forumosa.com/t/why-are-simple-things-so-hard-easycard-einvoice-easy-wallet-rant/227480,808,"August 26, 2023"
44,I fly business class and leave my kid in economy. I get called a 'bad mom',Parenting,https://tw.forumosa.com/t/i-fly-business-class-and-leave-my-kid-in-economy-i-get-called-a-bad-mom/232720,599,"August 18, 2023"
45,Schools for kids with ADHD,Parenting,https://tw.forumosa.com/t/schools-for-kids-with-adhd/228965,1018,"August 18, 2023"
46,Merry Christmas 2022,Open Forum,https://tw.forumosa.com/t/merry-christmas-2022/226217,443,"December 25, 2022"
47,Taiwanese Business Practises - Wack and Otherwise,Money,https://tw.forumosa.com/t/taiwanese-business-practises-wack-and-otherwise/226128,1059,"May 23, 2023"
48,"In Taiwan, society is seen as the top source of meaning in life",Culture & History,https://tw.forumosa.com/t/in-taiwan-society-is-seen-as-the-top-source-of-meaning-in-life/225159,1032,"November 18, 2022"
49,Wack Things in Taiwan 2023,Living in Taiwan,https://tw.forumosa.com/t/wack-things-in-taiwan-2023/226376,36079,"September 8, 2023"
