,title,category,url,num_views,last_reply_date
0,"Marriage and Divorce in Taiwan-12 Years of Love, Life, and Lessons Learned",Dating & Relationships,https://tw.forumosa.com/t/marriage-and-divorce-in-taiwan-12-years-of-love-life-and-lessons-learned/249615,2521,"September 27, 2025"
1,In Memory of @mick: A Stalwart Moderator and Friend,International Politics,https://tw.forumosa.com/t/in-memory-of-mick-a-stalwart-moderator-and-friend/250358,1363,"June 15, 2025"
2,For Charlie Jack--a memorium,Open Forum,https://tw.forumosa.com/t/for-charlie-jack-a-memorium/255007,426,"January 15, 2026"
3,Dealing with extreme silent treatment,Dating & Relationships,https://tw.forumosa.com/t/dealing-with-extreme-silent-treatment/251670,1871,"July 11, 2025"
4,Moving to Bangkok after 3.5 years in Taipei,International Travel,https://tw.forumosa.com/t/moving-to-bangkok-after-3-5-years-in-taipei/251955,2329,"November 2, 2025"
5,Sad Story - An American in Beitou,Living in Taiwan,https://tw.forumosa.com/t/sad-story-an-american-in-beitou/249609,1643,"March 31, 2025"
6,How Did You Get Poor In Taiwan?,Money,https://tw.forumosa.com/t/how-did-you-get-poor-in-taiwan/251487,605,"October 25, 2025"
7,Forumosa.com Announces Strategic Partnership with PTT,Feedback,https://tw.forumosa.com/t/forumosa-com-announces-strategic-partnership-with-ptt/250037,484,"June 22, 2025"
8,Control Yuan Survey of Foreign Nationals about Road Safety,Living in Taiwan,https://tw.forumosa.com/t/control-yuan-survey-of-foreign-nationals-about-road-safety/250958,684,"May 15, 2025"
9,Points of discussion to make our lives better in TW (bureaucratically speaking),Visa & Residency,https://tw.forumosa.com/t/points-of-discussion-to-make-our-lives-better-in-tw-bureaucratically-speaking/251099,237,"May 22, 2025"
10,Funny Pics 2026 (it rhymes!) :sweat_smile:,Fun & Games,https://tw.forumosa.com/t/funny-pics-2026-it-rhymes/255369,5711,"March 13, 2026"
11,"Myths, nailed it, and pleasant surprises about Taiwan",Living in Taiwan,https://tw.forumosa.com/t/myths-nailed-it-and-pleasant-surprises-about-taiwan/249815,1291,"April 1, 2025"
12,"Farewell, RT-Mart",Living in Taiwan,https://tw.forumosa.com/t/farewell-rt-mart/254234,1122,"March 4, 2026"
13,Leaving when you're old,Greater Forumosa,https://tw.forumosa.com/t/leaving-when-youre-old/252816,1235,"August 19, 2025"
14,In Memoriam,Living in Taiwan,https://tw.forumosa.com/t/in-memoriam/254797,659,"February 25, 2026"
15,My LASIK/SMILE experience at 大學眼科 in Hsinchu,Health & Fitness,https://tw.forumosa.com/t/my-lasik-smile-experience-at-in-hsinchu/249602,473,"May 24, 2025"
16,Warning: Chinatrust ATMs now illegally employing facial recognition,General Legal Matters,https://tw.forumosa.com/t/warning-chinatrust-atms-now-illegally-employing-facial-recognition/256301,195,"February 26, 2026"
17,Is traffic the worst part of Taiwan's lingering third worldism?,Living in Taiwan,https://tw.forumosa.com/t/is-traffic-the-worst-part-of-taiwans-lingering-third-worldism/250978,22380,"March 13, 2026"
18,"Just arrived in TW, already lonely",Living in Taiwan,https://tw.forumosa.com/t/just-arrived-in-tw-already-lonely/254913,952,"December 10, 2025"
19,Taiwan 🇹🇼 Wins Panettone Championship,Food & Drink,https://tw.forumosa.com/t/taiwan-wins-panettone-championship/254717,420,"November 28, 2025"
20,Feeling isolated in Taiwan,Living in Taiwan,https://tw.forumosa.com/t/feeling-isolated-in-taiwan/252627,1012,"September 7, 2025"
21,Shoutout to the good people at ChungHwa Post!,Living in Taiwan,https://tw.forumosa.com/t/shoutout-to-the-good-people-at-chunghwa-post/255071,243,"January 2, 2026"
22,Selfishness and evil,Open Forum,https://tw.forumosa.com/t/selfishness-and-evil/251080,680,"June 15, 2025"
23,Andrew Is Back In Taiwan (Help 🤗),Living in Taiwan,https://tw.forumosa.com/t/andrew-is-back-in-taiwan-help/255130,752,"December 27, 2025"
24,"Taiwan addresses bus driver shortage with higher wages (100,000 per month)",Living in Taiwan,https://tw.forumosa.com/t/taiwan-addresses-bus-driver-shortage-with-higher-wages-100-000-per-month/251991,871,"December 28, 2025"
25,Victim of scam,General Legal Matters,https://tw.forumosa.com/t/victim-of-scam/254616,354,"November 20, 2025"
26,Wack Things in Taiwan 2026,Living in Taiwan,https://tw.forumosa.com/t/wack-things-in-taiwan-2026/255374,5737,"March 14, 2026"
27,Typhoons 2025,Living in Taiwan,https://tw.forumosa.com/t/typhoons-2025/251473,12501,"January 14, 2026"
28,Man in Ximending stabs Korean university student,Living in Taiwan,https://tw.forumosa.com/t/man-in-ximending-stabs-korean-university-student/250132,439,"April 30, 2025"
29,Found a Lost White / Beige Shiba Inu,Animal Adoptions & Emergencies,https://tw.forumosa.com/t/found-a-lost-white-beige-shiba-inu/253178,274,"September 21, 2025"
30,"When will be the next 10,000NTD stimulus?",Open Forum,https://tw.forumosa.com/t/when-will-be-the-next-10-000ntd-stimulus/256336,329,"March 5, 2026"
31,New 10k stimulus - 10000.gov.tw,Taiwan Politics,https://tw.forumosa.com/t/new-10k-stimulus-10000-gov-tw/252218,6927,"February 19, 2026"
32,I was deported right after prison,Living in Taiwan,https://tw.forumosa.com/t/i-was-deported-right-after-prison/254457,1624,"November 20, 2025"
33,"Let Taiwan Fall, I’m Australian, and I’m Not Dying for a Country That Won’t Fight for Itself",Open Forum,https://tw.forumosa.com/t/let-taiwan-fall-i-m-australian-and-i-m-not-dying-for-a-country-that-won-t-fight-for-itself/252317,2576,"September 19, 2025"
34,Change in Banking rules in April 2025?,Money,https://tw.forumosa.com/t/change-in-banking-rules-in-april-2025/251104,698,"June 6, 2025"
35,Taiwanese inflexibility,Living in Taiwan,https://tw.forumosa.com/t/taiwanese-inflexibility/249766,3882,"January 21, 2026"
36,A rant about queueing in Taiwan,Living in Taiwan,https://tw.forumosa.com/t/a-rant-about-queueing-in-taiwan/249964,1000,"April 7, 2025"
37,Happy new year! 🎊,Living in Taiwan,https://tw.forumosa.com/t/happy-new-year/255368,205,"January 1, 2026"
38,Hypothetical Retirement At Age 33,Money,https://tw.forumosa.com/t/hypothetical-retirement-at-age-33/251736,667,"July 1, 2025"
39,"Rocky Horror 50th Anniversary Show in Taipei Oct. 31, 2025",Greater Taipei Events,https://tw.forumosa.com/t/rocky-horror-50th-anniversary-show-in-taipei-oct-31-2025/254147,229,"October 24, 2025"
40,Documentary: 看不見的國家 (Invisible Nation),Arts & Entertainment,https://tw.forumosa.com/t/documentary-invisible-nation/251621,573,"June 29, 2025"
41,Funny Political Pictures 2026 :smirking_face:,International Politics,https://tw.forumosa.com/t/funny-political-pictures-2026/255375,4750,"March 13, 2026"
42,Beach accidents in Taiwan,Open Forum,https://tw.forumosa.com/t/beach-accidents-in-taiwan/251395,609,"July 4, 2025"
43,Warning of assault in Taipei,Open Forum,https://tw.forumosa.com/t/warning-of-assault-in-taipei/251068,657,"July 20, 2025"
44,Joke of the day 2025,Fun & Games,https://tw.forumosa.com/t/joke-of-the-day-2025/251013,296,"January 24, 2026"
45,Best Place in Taiwan to Keep an Emergency Fund Without Watching It Slowly Die?,Money,https://tw.forumosa.com/t/best-place-in-taiwan-to-keep-an-emergency-fund-without-watching-it-slowly-die/251300,538,"June 1, 2025"
46,Taiwan Weather 2026,Living in Taiwan,https://tw.forumosa.com/t/taiwan-weather-2026/255411,1098,"March 11, 2026"
47,Hotel Pricing very high? Pretending to be sold out? Example: Fullon Waterfront Hotel in Tamsui,Open Forum,https://tw.forumosa.com/t/hotel-pricing-very-high-pretending-to-be-sold-out-example-fullon-waterfront-hotel-in-tamsui/250526,843,"September 30, 2025"
48,2025 Wanan air defense drill on July 15-18,Living in Taiwan,https://tw.forumosa.com/t/2025-wanan-air-defense-drill-on-july-15-18/252022,951,"August 1, 2025"
49,Taiwan-made Giant bike products banned in the US due to migrant worker abuse,Discrimination in Taiwan,https://tw.forumosa.com/t/taiwan-made-giant-bike-products-banned-in-the-us-due-to-migrant-worker-abuse/253711,763,"February 14, 2026"
