,title,category,url,num_views,last_reply_date
0,Had great fun freezing my ex-employer's assets today,Legal - Work,https://tw.forumosa.com/t/had-great-fun-freezing-my-ex-employers-assets-today/220110,4082,"July 21, 2022"
1,Going from Taiwan's Gold Card to Taiwanese Citizenship,Visa & Residency,https://tw.forumosa.com/t/going-from-taiwans-gold-card-to-taiwanese-citizenship/223715,2000,"April 2, 2023"
2,"Bye bye wife (2012-2022), bye bye Taiwan (2015-2022) - it feels awful Oki",Dating & Relationships,https://tw.forumosa.com/t/bye-bye-wife-2012-2022-bye-bye-taiwan-2015-2022-it-feels-awful-oki/220799,4907,"April 20, 2023"
3,I bought a house (+ Taiwan Home Loan Interest Calculator),Legal - Real Estate & Housing,https://tw.forumosa.com/t/i-bought-a-house-taiwan-home-loan-interest-calculator/229203,1609,"May 2, 2023"
4,We moved to Kaohsiung!,Living in Taiwan,https://tw.forumosa.com/t/we-moved-to-kaohsiung/228364,1559,"April 22, 2023"
5,We recorded all our expenses for 2 adults/1 child in New Taipei,Living in Taiwan,https://tw.forumosa.com/t/we-recorded-all-our-expenses-for-2-adults-1-child-in-new-taipei/222157,675,"August 2, 2022"
6,"If You See My Children in Kaohsiung, Tell Them I Love Them!",Legal - Divorce,https://tw.forumosa.com/t/if-you-see-my-children-in-kaohsiung-tell-them-i-love-them/223852,1800,"December 19, 2022"
7,No Public Transport discounts for Foreigners - let's get this fixed,Living in Taiwan,https://tw.forumosa.com/t/no-public-transport-discounts-for-foreigners-lets-get-this-fixed/219859,1471,"May 5, 2023"
8,"Happy New Year, Forumosa!",Open Forum,https://tw.forumosa.com/t/happy-new-year-forumosa/226358,521,"January 2, 2023"
9,Another complaint for a mildly annoying part of life,Living in Taiwan,https://tw.forumosa.com/t/another-complaint-for-a-mildly-annoying-part-of-life/223075,841,"January 16, 2023"
10,Guitars available for pre order,Buy and Sell,https://tw.forumosa.com/t/guitars-available-for-pre-order/222503,5869,"May 4, 2023"
11,Peak ChaBuDuo thread,Living in Taiwan,https://tw.forumosa.com/t/peak-chabuduo-thread/226131,921,"December 25, 2022"
12,Anxiety and Depression,Health & Fitness,https://tw.forumosa.com/t/anxiety-and-depression/228479,1520,"May 7, 2023"
13,Taiwan is a xenophobic country. Change my mind,Living in Taiwan,https://tw.forumosa.com/t/taiwan-is-a-xenophobic-country-change-my-mind/223919,5887,"November 9, 2022"
14,Taking pictures of strangers is considerably weird,Dating & Relationships,https://tw.forumosa.com/t/taking-pictures-of-strangers-is-considerably-weird/220980,1683,"February 12, 2023"
15,"Taiwan to distribute surplus tax revenue, NT$6,000 to every citizen",Taiwan Politics,https://tw.forumosa.com/t/taiwan-to-distribute-surplus-tax-revenue-nt-6-000-to-every-citizen/226442,11616,"May 4, 2023"
16,Funny Political Pictures 2023,International Politics,https://tw.forumosa.com/t/funny-political-pictures-2023/226371,11622,"May 7, 2023"
17,SE Asian dating a local guy,Dating & Relationships,https://tw.forumosa.com/t/se-asian-dating-a-local-guy/220952,1818,"June 26, 2022"
18,Tell us your happy Taiwanese relationship story,Dating & Relationships,https://tw.forumosa.com/t/tell-us-your-happy-taiwanese-relationship-story/225915,2145,"January 29, 2023"
19,Doorstepped by the Immigration Agency,Visa & Residency,https://tw.forumosa.com/t/doorstepped-by-the-immigration-agency/221038,2793,"July 13, 2022"
20,Dry January and Beyond (Ongoing Accountability group),Food & Drink,https://tw.forumosa.com/t/dry-january-and-beyond-ongoing-accountability-group/226318,8585,"May 5, 2023"
21,Saving Face,Working in Taiwan,https://tw.forumosa.com/t/saving-face/223999,617,"September 30, 2022"
22,TSMC’s U.S. Engineers Are “Babies” Say Taiwanese,Working in Taiwan,https://tw.forumosa.com/t/tsmc-s-u-s-engineers-are-babies-say-taiwanese/225101,4778,"March 30, 2023"
23,My new album is out!,Arts & Entertainment,https://tw.forumosa.com/t/my-new-album-is-out/226637,510,"January 15, 2023"
24,Coronavirus Taiwan - Specific Developments July-October 2022,Living in Taiwan,https://tw.forumosa.com/t/coronavirus-taiwan-specific-developments-july-october-2022/221296,33567,"November 3, 2022"
25,Censorship,Site Feedback,https://tw.forumosa.com/t/censorship/228677,625,"March 27, 2023"
26,Funny Pictures 2023,Fun & Games,https://tw.forumosa.com/t/funny-pictures-2023/226383,20205,"May 7, 2023"
27,Banks trying to improve?,Money,https://tw.forumosa.com/t/banks-trying-to-improve/220493,1444,"September 30, 2022"
28,"Student in Taiwan performing poorly, mother looks in schoolbag",Open Forum,https://tw.forumosa.com/t/student-in-taiwan-performing-poorly-mother-looks-in-schoolbag/221190,620,"July 16, 2022"
29,Thick coats and flip flops,Living in Taiwan,https://tw.forumosa.com/t/thick-coats-and-flip-flops/226983,820,"January 31, 2023"
30,Lost a close friend this summer,Open Forum,https://tw.forumosa.com/t/lost-a-close-friend-this-summer/223340,891,"September 15, 2022"
31,List of Non-discriminatory Financial Service Providers,Money,https://tw.forumosa.com/t/list-of-non-discriminatory-financial-service-providers/224215,633,"November 17, 2022"
32,China protests / uprisings - the start of Chinese Revolution 3.0? Effects on Taiwan?,Greater Forumosa,https://tw.forumosa.com/t/china-protests-uprisings-the-start-of-chinese-revolution-3-0-effects-on-taiwan/225547,4688,"February 21, 2023"
33,Types of Store Clerks in Taiwan [A 外國人 Perspective],Living in Taiwan,https://tw.forumosa.com/t/types-of-store-clerks-in-taiwan-a-perspective/222042,900,"July 29, 2022"
34,Pelosi visiting Taiwan in August 2022,Taiwan Politics,https://tw.forumosa.com/t/pelosi-visiting-taiwan-in-august-2022/221899,10255,"February 16, 2023"
35,Richart - The first almost/kinda/marginally/minuscularly foreigner friendly bank,Money,https://tw.forumosa.com/t/richart-the-first-almost-kinda-marginally-minuscularly-foreigner-friendly-bank/226485,6294,"May 4, 2023"
36,"‘Online’ Bank’s xenophobic reasoning for denying ""foreigners"" the ability to open an account online",Money,https://tw.forumosa.com/t/online-bank-s-xenophobic-reasoning-for-denying-foreigners-the-ability-to-open-an-account-online/222752,7130,"January 9, 2023"
37,Taiwanese rechao restaurants,Nationwide Restaurants,https://tw.forumosa.com/t/taiwanese-rechao-restaurants/229918,781,"May 7, 2023"
38,Alec of Taipei Bike Works - Accident & Road to Recovery,Living in Taiwan,https://tw.forumosa.com/t/alec-of-taipei-bike-works-accident-road-to-recovery/229572,886,"April 29, 2023"
39,Why are Taiwanese teachers so insistent on teaching English incorrectly?,Teaching English in Taiwan,https://tw.forumosa.com/t/why-are-taiwanese-teachers-so-insistent-on-teaching-english-incorrectly/225925,1274,"January 6, 2023"
40,Cat of the Day 2023,Fun & Games,https://tw.forumosa.com/t/cat-of-the-day-2023/226388,7292,"May 6, 2023"
41,Foreigners that grew up in Taiwan,Living in Taiwan,https://tw.forumosa.com/t/foreigners-that-grew-up-in-taiwan/228940,3229,"May 2, 2023"
42,Life on the MRT 2023,Living in Taiwan,https://tw.forumosa.com/t/life-on-the-mrt-2023/226391,1890,"April 16, 2023"
43,Wack Things in Taiwan 2023,Living in Taiwan,https://tw.forumosa.com/t/wack-things-in-taiwan-2023/226376,20260,"May 7, 2023"
44,Authentic Italian Restaurants in Taipei Area,Greater Taipei Restaurants,https://tw.forumosa.com/t/authentic-italian-restaurants-in-taipei-area/225324,1045,"February 7, 2023"
45,A day of dignity,Living in Taiwan,https://tw.forumosa.com/t/a-day-of-dignity/222474,1136,"August 16, 2022"
46,Merry Christmas 2022,Open Forum,https://tw.forumosa.com/t/merry-christmas-2022/226217,380,"December 25, 2022"
47,Man jumps out of 13th floor apartment after losing money on cryptocurrency gambling,Living in Taiwan,https://tw.forumosa.com/t/man-jumps-out-of-13th-floor-apartment-after-losing-money-on-cryptocurrency-gambling/220170,1314,"May 29, 2022"
48,Schools for kids with ADHD,Parenting,https://tw.forumosa.com/t/schools-for-kids-with-adhd/228965,753,"April 13, 2023"
49,Mid-life crisis purchase required - ideas?,Fun & Games,https://tw.forumosa.com/t/mid-life-crisis-purchase-required-ideas/221630,3189,"January 20, 2023"
