,title,category,url,num_views,last_reply_date
0,Jimipresley is heading back home,Open Forum,https://tw.forumosa.com/t/jimipresley-is-heading-back-home/235933,5983,"March 27, 2024"
1,2024.8.22 Dual Nationality Petition - Updates Only,Taiwan Politics,https://tw.forumosa.com/t/2024-8-22-dual-nationality-petition-updates-only/242455,3796,"October 4, 2024"
2,2024 August Dual Nationality Petition Open Discussion,Taiwan Politics,https://tw.forumosa.com/t/2024-august-dual-nationality-petition-open-discussion/243828,2427,"October 4, 2024"
3,Taiwan Rail Model Railway,Living in Taiwan,https://tw.forumosa.com/t/taiwan-rail-model-railway/244036,274,"September 19, 2024"
4,A foreigner’s rant: the agrochemical abyss of rural Taiwan,Living in Taiwan,https://tw.forumosa.com/t/a-foreigner-s-rant-the-agrochemical-abyss-of-rural-taiwan/239033,1222,"September 25, 2024"
5,Reminiscing about Taiwan. Care to join?,Living in Taiwan,https://tw.forumosa.com/t/reminiscing-about-taiwan-care-to-join/241005,1698,"June 16, 2024"
6,Congrats on the New Baby!,Living in Taiwan,https://tw.forumosa.com/t/congrats-on-the-new-baby/238881,510,"March 28, 2024"
7,A friend's child getting bullied by their grade school teacher,Parenting,https://tw.forumosa.com/t/a-friends-child-getting-bullied-by-their-grade-school-teacher/234931,1640,"November 8, 2023"
8,Most discrimination in Taiwan boils down to laws/regulations requiring household registration,Discrimination in Taiwan,https://tw.forumosa.com/t/most-discrimination-in-taiwan-boils-down-to-laws-regulations-requiring-household-registration/239715,1205,"May 24, 2024"
9,Don't f-in steal bikes in Taiwan,Cycling,https://tw.forumosa.com/t/dont-f-in-steal-bikes-in-taiwan/238819,1276,"March 30, 2024"
10,Taiwan's Windowless Work Environments,Working in Taiwan,https://tw.forumosa.com/t/taiwans-windowless-work-environments/239260,483,"April 7, 2024"
11,Funny Pictures 2024 :sweat_smile:,Fun & Games,https://tw.forumosa.com/t/funny-pictures-2024/236430,47074,"October 4, 2024"
12,"POPEYES was coming, now it's here!",Nationwide Restaurants,https://tw.forumosa.com/t/popeyes-was-coming-now-its-here/238647,5833,"September 10, 2024"
13,Tell me how long you've been in Taiwan without telling me how long you've been in Taiwan,Fun & Games,https://tw.forumosa.com/t/tell-me-how-long-youve-been-in-taiwan-without-telling-me-how-long-youve-been-in-taiwan/235289,2456,"January 12, 2024"
14,Are administrative appeals against the FSC completely pointless?,General Legal Matters,https://tw.forumosa.com/t/are-administrative-appeals-against-the-fsc-completely-pointless/236737,1237,"May 29, 2024"
15,Happy Lunar New Year 2024,Living in Taiwan,https://tw.forumosa.com/t/happy-lunar-new-year-2024/237646,1192,"March 26, 2024"
16,Finally feeling very settled in Taiwan -- We really love it here -- About time to leave?,Living in Taiwan,https://tw.forumosa.com/t/finally-feeling-very-settled-in-taiwan-we-really-love-it-here-about-time-to-leave/240140,1102,"May 16, 2024"
17,Wack Things in Taiwan 2024,Living in Taiwan,https://tw.forumosa.com/t/wack-things-in-taiwan-2024/236466,28285,"October 4, 2024"
18,Funny Political Pictures 2024 :smirk:,International Politics,https://tw.forumosa.com/t/funny-political-pictures-2024/236431,30377,"October 4, 2024"
19,Time to visit gov offices and banks and telcos,Money,https://tw.forumosa.com/t/time-to-visit-gov-offices-and-banks-and-telcos/234348,3780,"December 31, 2023"
20,The Last Days of Sanity: Madness in the Cram School - A Teacher's Tale,Teaching English in Taiwan,https://tw.forumosa.com/t/the-last-days-of-sanity-madness-in-the-cram-school-a-teachers-tale/238637,1997,"March 31, 2024"
21,Taking action against Taiwan's definition of domicile/residence relating to foreigners,Discrimination in Taiwan,https://tw.forumosa.com/t/taking-action-against-taiwans-definition-of-domicile-residence-relating-to-foreigners/236419,6632,"September 24, 2024"
22,Non-legal aspects regarding advantages of having Taiwan Citizenship,Living in Taiwan,https://tw.forumosa.com/t/non-legal-aspects-regarding-advantages-of-having-taiwan-citizenship/235288,1371,"December 10, 2023"
23,Taitung and Thereabouts Thread,Living in Taiwan,https://tw.forumosa.com/t/taitung-and-thereabouts-thread/240336,1158,"August 30, 2024"
24,Foreigners Behaving Badly in Taiwan,Living in Taiwan,https://tw.forumosa.com/t/foreigners-behaving-badly-in-taiwan/238666,6402,"June 11, 2024"
25,YouTuber's Experience Buying a House in Taiwan,Money,https://tw.forumosa.com/t/youtubers-experience-buying-a-house-in-taiwan/234028,688,"October 6, 2023"
26,Taipei Polam Kopitiam (Xinyi branch) food poisoning,Greater Taipei Restaurants,https://tw.forumosa.com/t/taipei-polam-kopitiam-xinyi-branch-food-poisoning/238904,3584,"July 16, 2024"
27,What is it actually like to become Taiwanese?,Living in Taiwan,https://tw.forumosa.com/t/what-is-it-actually-like-to-become-taiwanese/239036,2324,"September 11, 2024"
28,Have any foreigners opened a bank account without using their passport?,Discrimination in Taiwan,https://tw.forumosa.com/t/have-any-foreigners-opened-a-bank-account-without-using-their-passport/236622,1015,"April 3, 2024"
29,Noel's new Taiwan YouTube channel,YouTube & Other Video Clips,https://tw.forumosa.com/t/noels-new-taiwan-youtube-channel/235851,976,"May 3, 2024"
30,Foreigner assaults taxi driver - government connections make it go away,Living in Taiwan,https://tw.forumosa.com/t/foreigner-assaults-taxi-driver-government-connections-make-it-go-away/234279,2601,"October 21, 2023"
31,Destitute travellers,Living in Taiwan,https://tw.forumosa.com/t/destitute-travellers/242493,1460,"September 13, 2024"
32,Banking rant (traveling outside of Taiwan),Money,https://tw.forumosa.com/t/banking-rant-traveling-outside-of-taiwan/237280,579,"January 29, 2024"
33,Which digital banks in Taiwan refuse to provide services to foreigners?,Discrimination in Taiwan,https://tw.forumosa.com/t/which-digital-banks-in-taiwan-refuse-to-provide-services-to-foreigners/237638,709,"April 2, 2024"
34,Insecurity about my appearance in Taiwan,Dating & Relationships,https://tw.forumosa.com/t/insecurity-about-my-appearance-in-taiwan/239479,2792,"June 2, 2024"
35,Busybody amahs,Parenting,https://tw.forumosa.com/t/busybody-amahs/242794,458,"August 9, 2024"
36,Cat of the Day 2024 :cat:,Fun & Games,https://tw.forumosa.com/t/cat-of-the-day-2024/236456,8792,"October 4, 2024"
37,Air Raid Alert - Rocket Flyover - Not a Drill,Taiwan Politics,https://tw.forumosa.com/t/air-raid-alert-rocket-flyover-not-a-drill/236685,3398,"June 26, 2024"
38,Earthquakes 2024,Living in Taiwan,https://tw.forumosa.com/t/earthquakes-2024/236454,24940,"October 1, 2024"
39,Got stalked by a local dude,Living in Taiwan,https://tw.forumosa.com/t/got-stalked-by-a-local-dude/234720,1886,"December 17, 2023"
40,Israel declares state of war after terrorist attacks,International Politics,https://tw.forumosa.com/t/israel-declares-state-of-war-after-terrorist-attacks/234077,53321,"October 4, 2024"
41,Carnaval en Taipei February 24-25 Taipei Expo Park Yuanshan MRT Maji Square,Greater Taipei Events,https://tw.forumosa.com/t/carnaval-en-taipei-february-24-25-taipei-expo-park-yuanshan-mrt-maji-square/238016,764,"February 25, 2024"
42,How many of the old timers are still active here?,Open Forum,https://tw.forumosa.com/t/how-many-of-the-old-timers-are-still-active-here/241080,1320,"July 27, 2024"
43,The Morgue 2024,Open Forum,https://tw.forumosa.com/t/the-morgue-2024/236675,7385,"October 1, 2024"
44,2024 Parliamentary Clashes - Forced Legislation and Subsequent Protests,Taiwan Politics,https://tw.forumosa.com/t/2024-parliamentary-clashes-forced-legislation-and-subsequent-protests/240364,4757,"August 6, 2024"
45,Rites of passage to be a waiguoren in Taiwan,Living in Taiwan,https://tw.forumosa.com/t/rites-of-passage-to-be-a-waiguoren-in-taiwan/244530,1341,"October 1, 2024"
46,"Acid reflux, abdominal pain, and obesity",Health & Fitness,https://tw.forumosa.com/t/acid-reflux-abdominal-pain-and-obesity/238197,698,"April 6, 2024"
47,Death of baby of undocumented migrant workers,Living in Taiwan,https://tw.forumosa.com/t/death-of-baby-of-undocumented-migrant-workers/238683,922,"March 21, 2024"
48,What the hell is going on in South Africa?,Greater Forumosa,https://tw.forumosa.com/t/what-the-hell-is-going-on-in-south-africa/238755,1150,"April 5, 2024"
49,"KMT MP Admits Family-Owned Breakfast Shop Made NT$20,000 per Day",Taiwan Politics,https://tw.forumosa.com/t/kmt-mp-admits-family-owned-breakfast-shop-made-nt-20-000-per-day/239591,1516,"April 27, 2024"
