,title,category,url,num_views,last_reply_date
0,Jimipresley is heading back home,Open Forum,https://tw.forumosa.com/t/jimipresley-is-heading-back-home/235933,5771,"March 27, 2024"
1,"Farewell, Dragonbones! 💔",Open Forum,https://tw.forumosa.com/t/farewell-dragonbones/232900,7241,"November 5, 2023"
2,Feeling Disillusioned as an Indian in Taiwan,Living in Taiwan,https://tw.forumosa.com/t/feeling-disillusioned-as-an-indian-in-taiwan/233556,4915,"October 6, 2023"
3,Masks: Damaging the Youth of Taiwan,Health & Fitness,https://tw.forumosa.com/t/masks-damaging-the-youth-of-taiwan/233107,4326,"September 29, 2023"
4,Stereotypes in Taiwan about other races / nationalities,Living in Taiwan,https://tw.forumosa.com/t/stereotypes-in-taiwan-about-other-races-nationalities/231817,3034,"May 20, 2024"
5,Selfish person of the day (in Taiwan),Living in Taiwan,https://tw.forumosa.com/t/selfish-person-of-the-day-in-taiwan/232734,2732,"May 6, 2024"
6,Congrats on the New Baby!,Living in Taiwan,https://tw.forumosa.com/t/congrats-on-the-new-baby/238881,464,"March 28, 2024"
7,A friend's child getting bullied by their grade school teacher,Parenting,https://tw.forumosa.com/t/a-friends-child-getting-bullied-by-their-grade-school-teacher/234931,1560,"November 8, 2023"
8,A foreigner’s rant: the agrochemical abyss of rural Taiwan,Living in Taiwan,https://tw.forumosa.com/t/a-foreigner-s-rant-the-agrochemical-abyss-of-rural-taiwan/239033,688,"April 1, 2024"
9,Most discrimination in Taiwan boils down to laws/regulations requiring household registration,Discrimination in Taiwan,https://tw.forumosa.com/t/most-discrimination-in-taiwan-boils-down-to-laws-regulations-requiring-household-registration/239715,1114,"May 24, 2024"
10,Don't f-in steal bikes in Taiwan,Cycling,https://tw.forumosa.com/t/dont-f-in-steal-bikes-in-taiwan/238819,1143,"March 30, 2024"
11,2023 WanAn air raid drill (IMPORTANT!),Living in Taiwan,https://tw.forumosa.com/t/2023-wanan-air-raid-drill-important/231693,2420,"January 9, 2024"
12,Taiwan's Windowless Work Environments,Working in Taiwan,https://tw.forumosa.com/t/taiwans-windowless-work-environments/239260,413,"April 7, 2024"
13,CTBC Discrimination? Why Foreigners Can't Use Their Cards Properly!,Discrimination in Taiwan,https://tw.forumosa.com/t/ctbc-discrimination-why-foreigners-cant-use-their-cards-properly/231332,1931,"March 26, 2024"
14,Funny Pictures 2024 :sweat_smile:,Fun & Games,https://tw.forumosa.com/t/funny-pictures-2024/236430,32341,"June 7, 2024"
15,:hotel: Hotel Booking | Booking.com scams PSA,International Travel,https://tw.forumosa.com/t/hotel-booking-booking-com-scams-psa/231648,804,"January 24, 2024"
16,Tell me how long you've been in Taiwan without telling me how long you've been in Taiwan,Fun & Games,https://tw.forumosa.com/t/tell-me-how-long-youve-been-in-taiwan-without-telling-me-how-long-youve-been-in-taiwan/235289,2362,"January 12, 2024"
17,A New Low ~ Preschool Suspected of Drugging Pupils,Parenting,https://tw.forumosa.com/t/a-new-low-preschool-suspected-of-drugging-pupils/230969,6056,"September 23, 2023"
18,Are administrative appeals against the FSC completely pointless?,General Legal Matters,https://tw.forumosa.com/t/are-administrative-appeals-against-the-fsc-completely-pointless/236737,1179,"May 29, 2024"
19,"POPEYES was coming, now it's here!",Nationwide Restaurants,https://tw.forumosa.com/t/popeyes-was-coming-now-its-here/238647,4375,"June 7, 2024"
20,Happy Lunar New Year 2024,Living in Taiwan,https://tw.forumosa.com/t/happy-lunar-new-year-2024/237646,1081,"March 26, 2024"
21,Finally feeling very settled in Taiwan -- We really love it here -- About time to leave?,Living in Taiwan,https://tw.forumosa.com/t/finally-feeling-very-settled-in-taiwan-we-really-love-it-here-about-time-to-leave/240140,1034,"May 16, 2024"
22,Done with living in TW,Living in Taiwan,https://tw.forumosa.com/t/done-with-living-in-tw/233494,3521,"September 25, 2023"
23,An urgent request - from our beloved forumosan Dragonbones,Health & Fitness,https://tw.forumosa.com/t/an-urgent-request-from-our-beloved-forumosan-dragonbones/233306,1500,"November 6, 2023"
24,Death to QR Codes! (Restaurants and Menus),Nationwide Restaurants,https://tw.forumosa.com/t/death-to-qr-codes-restaurants-and-menus/232700,4225,"May 22, 2024"
25,JDSmith's Very Own Taitung and Thereabouts Thread,Living in Taiwan,https://tw.forumosa.com/t/jdsmiths-very-own-taitung-and-thereabouts-thread/240336,817,"May 30, 2024"
26,Finally moving back to Taiwan (Noel update),Living in Taiwan,https://tw.forumosa.com/t/finally-moving-back-to-taiwan-noel-update/232447,856,"August 7, 2023"
27,Time to visit gov offices and banks and telcos,Money,https://tw.forumosa.com/t/time-to-visit-gov-offices-and-banks-and-telcos/234348,3624,"December 31, 2023"
28,Wack Things in Taiwan 2024,Living in Taiwan,https://tw.forumosa.com/t/wack-things-in-taiwan-2024/236466,17957,"June 7, 2024"
29,The Last Days of Sanity: Madness in the Cram School - A Teacher's Tale,Teaching English in Taiwan,https://tw.forumosa.com/t/the-last-days-of-sanity-madness-in-the-cram-school-a-teachers-tale/238637,1842,"March 31, 2024"
30,Got fired for asking my school to use standard international units in their science book,Visa & Residency,https://tw.forumosa.com/t/got-fired-for-asking-my-school-to-use-standard-international-units-in-their-science-book/232562,1892,"August 16, 2023"
31,Non-legal aspects regarding advantages of having Taiwan Citizenship,Living in Taiwan,https://tw.forumosa.com/t/non-legal-aspects-regarding-advantages-of-having-taiwan-citizenship/235288,1218,"December 10, 2023"
32,Funny Political Pictures 2024 :smirk:,International Politics,https://tw.forumosa.com/t/funny-political-pictures-2024/236431,20266,"June 7, 2024"
33,Foreigners Behaving Badly in Taiwan,Living in Taiwan,https://tw.forumosa.com/t/foreigners-behaving-badly-in-taiwan/238666,5604,"May 21, 2024"
34,I did the unthinkable (outside of the HVAC trade),Technology,https://tw.forumosa.com/t/i-did-the-unthinkable-outside-of-the-hvac-trade/233021,1118,"September 16, 2023"
35,YouTuber's Experience Buying a House in Taiwan,Money,https://tw.forumosa.com/t/youtubers-experience-buying-a-house-in-taiwan/234028,641,"October 6, 2023"
36,Disrespectful Cousin,Dating & Relationships,https://tw.forumosa.com/t/disrespectful-cousin/231350,1187,"August 28, 2023"
37,Taipei Polam Kopitiam (Xinyi branch) food poisoning,Greater Taipei Restaurants,https://tw.forumosa.com/t/taipei-polam-kopitiam-xinyi-branch-food-poisoning/238904,3128,"June 7, 2024"
38,What is it actually like to become Taiwanese?,Living in Taiwan,https://tw.forumosa.com/t/what-is-it-actually-like-to-become-taiwanese/239036,2067,"April 24, 2024"
39,Have any foreigners opened a bank account without using their passport?,Discrimination in Taiwan,https://tw.forumosa.com/t/have-any-foreigners-opened-a-bank-account-without-using-their-passport/236622,933,"April 3, 2024"
40,I fly business class and leave my kid in economy. I get called a 'bad mom',Parenting,https://tw.forumosa.com/t/i-fly-business-class-and-leave-my-kid-in-economy-i-get-called-a-bad-mom/232720,1084,"August 18, 2023"
41,Noel's new Taiwan YouTube channel,YouTube & Other Video Clips,https://tw.forumosa.com/t/noels-new-taiwan-youtube-channel/235851,918,"May 3, 2024"
42,Taking action against Taiwan's definition of domicile/residence relating to foreigners,Discrimination in Taiwan,https://tw.forumosa.com/t/taking-action-against-taiwans-definition-of-domicile-residence-relating-to-foreigners/236419,5477,"June 7, 2024"
43,Foreigner assaults taxi driver - government connections make it go away,Living in Taiwan,https://tw.forumosa.com/t/foreigner-assaults-taxi-driver-government-connections-make-it-go-away/234279,2515,"October 21, 2023"
44,Banking rant (traveling outside of Taiwan),Money,https://tw.forumosa.com/t/banking-rant-traveling-outside-of-taiwan/237280,547,"January 29, 2024"
45,Which digital banks in Taiwan refuse to provide services to foreigners?,Discrimination in Taiwan,https://tw.forumosa.com/t/which-digital-banks-in-taiwan-refuse-to-provide-services-to-foreigners/237638,633,"April 2, 2024"
46,Insecurity about my appearance in Taiwan,Dating & Relationships,https://tw.forumosa.com/t/insecurity-about-my-appearance-in-taiwan/239479,2436,"June 2, 2024"
47,What Citizenships can I Buy?,Open Forum,https://tw.forumosa.com/t/what-citizenships-can-i-buy/233830,1385,"October 20, 2023"
48,Strange interaction I had with a Taiwanese person,Living in Taiwan,https://tw.forumosa.com/t/strange-interaction-i-had-with-a-taiwanese-person/232644,820,"August 25, 2023"
49,Air Raid Alert - Rocket Flyover - Not a Drill,Taiwan Politics,https://tw.forumosa.com/t/air-raid-alert-rocket-flyover-not-a-drill/236685,3121,"January 10, 2024"
