,title,category,url,num_views,last_reply_date
0,"Warning for anyone considering using ""Hello Taipei"" to report illegal work activity",Working in Taiwan,https://tw.forumosa.com/t/warning-for-anyone-considering-using-hello-taipei-to-report-illegal-work-activity/207016,2637,"May 23, 2021"
1,Good young people in Taiwan,Living in Taiwan,https://tw.forumosa.com/t/good-young-people-in-taiwan/203329,1013,"March 4, 2021"
2,How Amateur Sleuths Broke the Wuhan Lab Story and Embarrassed the Media,Science & Nature,https://tw.forumosa.com/t/how-amateur-sleuths-broke-the-wuhan-lab-story-and-embarrassed-the-media/208027,4919,"January 13, 2022"
3,Typhoon Guitar is moving,Business Directory,https://tw.forumosa.com/t/typhoon-guitar-is-moving/211928,987,"December 20, 2021"
4,Is there discrimination here? Is it a concern?,Living in Taiwan,https://tw.forumosa.com/t/is-there-discrimination-here-is-it-a-concern/202504,1910,"February 10, 2021"
5,Left Taiwan for good,Living in Taiwan,https://tw.forumosa.com/t/left-taiwan-for-good/203580,1068,"March 9, 2021"
6,Share your Covid Vaccination Experience Here,Health & Fitness,https://tw.forumosa.com/t/share-your-covid-vaccination-experience-here/210250,6310,"December 7, 2021"
7,Top-10 things I miss the most about Taiwan that I can’t experience in crappy England,Living in Taiwan,https://tw.forumosa.com/t/top-10-things-i-miss-the-most-about-taiwan-that-i-can-t-experience-in-crappy-england/208302,2267,"July 13, 2021"
8,Any other Forumosans in a Taiwanese quarantine hotel?,Living in Taiwan,https://tw.forumosa.com/t/any-other-forumosans-in-a-taiwanese-quarantine-hotel/210164,9451,"January 16, 2022"
9,Cathay General Hospital - Idiots or Anti-foreigners?,Health & Fitness,https://tw.forumosa.com/t/cathay-general-hospital-idiots-or-anti-foreigners/211763,884,"September 11, 2021"
10,Forced to take a COVID test after visiting a hospital for flu,Health & Fitness,https://tw.forumosa.com/t/forced-to-take-a-covid-test-after-visiting-a-hospital-for-flu/207118,1030,"May 21, 2021"
11,We are done with Canada (Retirement update),Open Forum,https://tw.forumosa.com/t/we-are-done-with-canada-retirement-update/209185,2414,"October 21, 2021"
12,The COVID humbug thread (2021 edition),Health & Fitness,https://tw.forumosa.com/t/the-covid-humbug-thread-2021-edition/209238,24287,"January 5, 2022"
13,Any female users on here?,Site Feedback,https://tw.forumosa.com/t/any-female-users-on-here/202179,1497,"February 12, 2021"
14,Taiwan is LOUD (compared to Europe) & drivers can only be as bad as the roads let them,Living in Taiwan,https://tw.forumosa.com/t/taiwan-is-loud-compared-to-europe-drivers-can-only-be-as-bad-as-the-roads-let-them/209100,1985,"January 7, 2022"
15,Getting the 2nd shot in Taiwan for COVID-19 vaccines,Health & Fitness,https://tw.forumosa.com/t/getting-the-2nd-shot-in-taiwan-for-covid-19-vaccines/208484,13219,"January 12, 2022"
16,Tragic death of a foreign woman. No news coverage,Living in Taiwan,https://tw.forumosa.com/t/tragic-death-of-a-foreign-woman-no-news-coverage/206513,2182,"June 16, 2021"
17,A Day in The Life of Ivan Duckedevitch,Living in Taiwan,https://tw.forumosa.com/t/a-day-in-the-life-of-ivan-duckedevitch/215796,435,"January 17, 2022"
18,My experience of living in Taiwan as a newcomer,Living in Taiwan,https://tw.forumosa.com/t/my-experience-of-living-in-taiwan-as-a-newcomer/213519,1776,"October 31, 2021"
19,Child Needs Year Off from School due to Abuse,General Legal Matters,https://tw.forumosa.com/t/child-needs-year-off-from-school-due-to-abuse/212745,869,"November 2, 2021"
20,Info about how to get the Coronavirus Vaccine (Non-discussion thread),Health & Fitness,https://tw.forumosa.com/t/info-about-how-to-get-the-coronavirus-vaccine-non-discussion-thread/208887,4104,"December 28, 2021"
21,Taiwan : Island of bosses,Living in Taiwan,https://tw.forumosa.com/t/taiwan-island-of-bosses/206332,3571,"June 3, 2021"
22,BigDave’s weight loss progress,Health & Fitness,https://tw.forumosa.com/t/bigdave-s-weight-loss-progress/208903,2158,"July 21, 2021"
23,Scrolling function has issues (Scroll Jank),Site Feedback,https://tw.forumosa.com/t/scrolling-function-has-issues-scroll-jank/209548,1631,"January 17, 2022"
24,They will have to pry Taiwan from my dying hands,Living in Taiwan,https://tw.forumosa.com/t/they-will-have-to-pry-taiwan-from-my-dying-hands/206392,863,"May 9, 2021"
25,How to build a long and successful career in Taiwan as a foreigner,Working in Taiwan,https://tw.forumosa.com/t/how-to-build-a-long-and-successful-career-in-taiwan-as-a-foreigner/210802,774,"August 7, 2021"
26,"My dear bicycle was stolen tonight, so sad (+police's help) BIKE FOUND",Cycling,https://tw.forumosa.com/t/my-dear-bicycle-was-stolen-tonight-so-sad-polices-help-bike-found/212684,1390,"December 1, 2021"
27,Forced move to Quarantine Center ... how legal is that?,General Legal Matters,https://tw.forumosa.com/t/forced-move-to-quarantine-center-how-legal-is-that/212028,1314,"September 11, 2021"
28,Selected Helpful Posts Related to Covid (May 2021- ),International Travel,https://tw.forumosa.com/t/selected-helpful-posts-related-to-covid-may-2021/207840,2629,"November 23, 2021"
29,Things you don't see in Taiwan anymore,Living in Taiwan,https://tw.forumosa.com/t/things-you-dont-see-in-taiwan-anymore/215866,1339,"January 19, 2022"
30,Power Plant Shutdown Presidential Alert (13 / 17 May 2021),Living in Taiwan,https://tw.forumosa.com/t/power-plant-shutdown-presidential-alert-13-17-may-2021/206606,3298,"June 1, 2021"
31,My name is white supremacy?,Open Forum,https://tw.forumosa.com/t/my-name-is-white-supremacy/204521,1601,"April 5, 2021"
32,Exploring Taiwanese Indie/Rock Scene,Arts & Entertainment,https://tw.forumosa.com/t/exploring-taiwanese-indie-rock-scene/204838,814,"August 10, 2021"
33,Why don’t some of my posts have a heart on?,Site Feedback,https://tw.forumosa.com/t/why-don-t-some-of-my-posts-have-a-heart-on/210035,1066,"July 20, 2021"
34,Should foreigners in Taiwan care about Taiwan if Taiwan doesn't care about foreign residents?,Living in Taiwan,https://tw.forumosa.com/t/should-foreigners-in-taiwan-care-about-taiwan-if-taiwan-doesnt-care-about-foreign-residents/209469,5798,"October 8, 2021"
35,"How to buy food online during the 2021 Covid-19 outbreak, and after",Food & Drink,https://tw.forumosa.com/t/how-to-buy-food-online-during-the-2021-covid-19-outbreak-and-after/207762,865,"September 7, 2021"
36,Tech workers who flocked to Taiwan’s Covid-free haven are now fleeing,Living in Taiwan,https://tw.forumosa.com/t/tech-workers-who-flocked-to-taiwan-s-covid-free-haven-are-now-fleeing/208029,3546,"October 30, 2021"
37,Lack of pride for rental landlords,Living in Taiwan,https://tw.forumosa.com/t/lack-of-pride-for-rental-landlords/214338,2301,"December 24, 2021"
38,Coronavirus Vaccine in Taiwan - May/June 2021,Health & Fitness,https://tw.forumosa.com/t/coronavirus-vaccine-in-taiwan-may-june-2021/206715,31847,"July 1, 2021"
39,Precautions when cycling in Taiwan during COVID,Cycling,https://tw.forumosa.com/t/precautions-when-cycling-in-taiwan-during-covid/206611,3941,"November 2, 2021"
40,"John Cena, Apologizing to China",International Politics,https://tw.forumosa.com/t/john-cena-apologizing-to-china/207452,2150,"July 2, 2021"
41,COVID-19 Booster Shots in Taiwan,Health & Fitness,https://tw.forumosa.com/t/covid-19-booster-shots-in-taiwan/214061,4687,"January 19, 2022"
42,Audrey Tang 唐鳳 Taiwan’s Digital Minister,Taiwan Politics,https://tw.forumosa.com/t/audrey-tang-taiwan-s-digital-minister/206828,1534,"December 13, 2021"
43,On sexual crimes and false accusations,Open Forum,https://tw.forumosa.com/t/on-sexual-crimes-and-false-accusations/205701,1756,"December 3, 2021"
44,Bad interviews,Working in Taiwan,https://tw.forumosa.com/t/bad-interviews/202352,728,"February 4, 2021"
45,WARNING: APRC Applications Now Require Appointments...in Level 2,Visa & Residency,https://tw.forumosa.com/t/warning-aprc-applications-now-require-appointments-in-level-2/211238,912,"September 17, 2021"
46,Coronavirus - Taiwan OPEN June 2021,Living in Taiwan,https://tw.forumosa.com/t/coronavirus-taiwan-open-june-2021/207874,30979,"July 2, 2021"
47,"Interesting ways (not online) meeting new friends/partners in Taiwan, stories? Fun stories",Dating & Relationships,https://tw.forumosa.com/t/interesting-ways-not-online-meeting-new-friends-partners-in-taiwan-stories-fun-stories/205785,1392,"June 11, 2021"
48,Coronavirus Vaccine in Taiwan - July/August 2021,Health & Fitness,https://tw.forumosa.com/t/coronavirus-vaccine-in-taiwan-july-august-2021/209223,26578,"September 2, 2021"
49,Merry Christmas 2021,Open Forum,https://tw.forumosa.com/t/merry-christmas-2021/215056,331,"December 28, 2021"
