,title,category,url,num_views,last_reply_date
0,"Warning for anyone considering using ""Hello Taipei"" to report illegal work activity",Working in Taiwan,https://tw.forumosa.com/t/warning-for-anyone-considering-using-hello-taipei-to-report-illegal-work-activity/207016,2184,"May 23, 2021"
1,Thank You For A Real Good Time,Testimonials,https://tw.forumosa.com/t/thank-you-for-a-real-good-time/198723,705,"November 13, 2020"
2,Good young people in Taiwan,Living in Taiwan,https://tw.forumosa.com/t/good-young-people-in-taiwan/203329,867,"March 4, 2021"
3,I Was Accosted By Cops,Living in Taiwan,https://tw.forumosa.com/t/i-was-accosted-by-cops/201695,1776,"January 24, 2021"
4,I would very much like an alternative forum that was much more heavily regulated,Site Feedback,https://tw.forumosa.com/t/i-would-very-much-like-an-alternative-forum-that-was-much-more-heavily-regulated/197770,4879,"November 13, 2020"
5,How Amateur Sleuths Broke the Wuhan Lab Story and Embarrassed the Media,Science & Nature,https://tw.forumosa.com/t/how-amateur-sleuths-broke-the-wuhan-lab-story-and-embarrassed-the-media/208027,2896,"July 3, 2021"
6,2020 : My journey towards getting Taiwanese Citizenship for myself and my infant daughter,Dual Nationality,https://tw.forumosa.com/t/2020-my-journey-towards-getting-taiwanese-citizenship-for-myself-and-my-infant-daughter/200619,1547,"June 29, 2021"
7,Left Taiwan for good,Living in Taiwan,https://tw.forumosa.com/t/left-taiwan-for-good/203580,963,"March 9, 2021"
8,Is there discrimination here? Is it a concern?,Living in Taiwan,https://tw.forumosa.com/t/is-there-discrimination-here-is-it-a-concern/202504,1380,"February 10, 2021"
9,Top-10 things I miss the most about Taiwan that I can’t experience in crappy England,Living in Taiwan,https://tw.forumosa.com/t/top-10-things-i-miss-the-most-about-taiwan-that-i-can-t-experience-in-crappy-england/208302,1848,"July 13, 2021"
10,Wack Things In Taiwan 2021,Living in Taiwan,https://tw.forumosa.com/t/wack-things-in-taiwan-2021/200851,20433,"August 7, 2021"
11,Forced to take a COVID test after visiting a hospital for flu,Health & Fitness,https://tw.forumosa.com/t/forced-to-take-a-covid-test-after-visiting-a-hospital-for-flu/207118,831,"May 21, 2021"
12,Anecdote: My slippery grasp of Mandarin,Living in Taiwan,https://tw.forumosa.com/t/anecdote-my-slippery-grasp-of-mandarin/197362,641,"November 2, 2020"
13,Funny Political Pictures II,International Politics,https://tw.forumosa.com/t/funny-political-pictures-ii/197228,30559,"August 7, 2021"
14,Too US-centric?,Site Feedback,https://tw.forumosa.com/t/too-us-centric/196684,810,"September 20, 2020"
15,Forumosa Soy Sauce....What?,Food & Drink,https://tw.forumosa.com/t/forumosa-soy-sauce-what/199846,1001,"May 15, 2021"
16,Share your Covid Vaccination Experience Here,Health & Fitness,https://tw.forumosa.com/t/share-your-covid-vaccination-experience-here/210250,1987,"August 8, 2021"
17,🆔 New format for ARC/APRC number is not accepted--testing and reporting thread,Living in Taiwan,https://tw.forumosa.com/t/new-format-for-arc-aprc-number-is-not-accepted-testing-and-reporting-thread/200014,7339,"August 4, 2021"
18,Guide: How to register a 'real' English name for your Taiwanese child,Dual Nationality,https://tw.forumosa.com/t/guide-how-to-register-a-real-english-name-for-your-taiwanese-child/198586,1044,"July 17, 2021"
19,Share your Taiwan Salary Anonymously,Working in Taiwan,https://tw.forumosa.com/t/share-your-taiwan-salary-anonymously/195852,7861,"July 13, 2021"
20,Any female users on here?,Site Feedback,https://tw.forumosa.com/t/any-female-users-on-here/202179,1350,"February 12, 2021"
21,Any other Forumosans in a Taiwanese quarantine hotel?,Living in Taiwan,https://tw.forumosa.com/t/any-other-forumosans-in-a-taiwanese-quarantine-hotel/210164,1387,"August 4, 2021"
22,We are done with Canada (Retirement update),Open Forum,https://tw.forumosa.com/t/we-are-done-with-canada-retirement-update/209185,682,"July 28, 2021"
23,A Hong Kong Funeral,Open Forum,https://tw.forumosa.com/t/a-hong-kong-funeral/200927,378,"May 25, 2021"
24,Taiwan is LOUD (compared to Europe) & drivers can only be as bad as the roads let them,Living in Taiwan,https://tw.forumosa.com/t/taiwan-is-loud-compared-to-europe-drivers-can-only-be-as-bad-as-the-roads-let-them/209100,1366,"July 6, 2021"
25,Tragic death of a foreign woman. No news coverage,Living in Taiwan,https://tw.forumosa.com/t/tragic-death-of-a-foreign-woman-no-news-coverage/206513,1789,"June 16, 2021"
26,Getting the 2nd shot in Taiwan for COVID-19 vaccines,Health & Fitness,https://tw.forumosa.com/t/getting-the-2nd-shot-in-taiwan-for-covid-19-vaccines/208484,6224,"August 7, 2021"
27,Taiwan : Island of bosses,Living in Taiwan,https://tw.forumosa.com/t/taiwan-island-of-bosses/206332,2916,"June 3, 2021"
28,Taiwan Food Diaries - Quarantine Hotel Edition,Food & Drink,https://tw.forumosa.com/t/taiwan-food-diaries-quarantine-hotel-edition/197663,4797,"February 16, 2021"
29,"'I am Taiwanese' Czech speaker tells parliament, likely to rile China",International Politics,https://tw.forumosa.com/t/i-am-taiwanese-czech-speaker-tells-parliament-likely-to-rile-china/196072,1430,"March 4, 2021"
30,BigDave’s weight loss progress,Health & Fitness,https://tw.forumosa.com/t/bigdave-s-weight-loss-progress/208903,1868,"July 21, 2021"
31,They will have to pry Taiwan from my dying hands,Living in Taiwan,https://tw.forumosa.com/t/they-will-have-to-pry-taiwan-from-my-dying-hands/206392,785,"May 9, 2021"
32,Info about how to get the Coronavirus Vaccine (Non-discussion thread),Health & Fitness,https://tw.forumosa.com/t/info-about-how-to-get-the-coronavirus-vaccine-non-discussion-thread/208887,2041,"August 7, 2021"
33,Power Plant Shutdown Presidential Alert (13 / 17 May 2021),Living in Taiwan,https://tw.forumosa.com/t/power-plant-shutdown-presidential-alert-13-17-may-2021/206606,2566,"June 1, 2021"
34,The COVID humbug thread,Health & Fitness,https://tw.forumosa.com/t/the-covid-humbug-thread/209238,4600,"August 7, 2021"
35,My name is white supremacy?,Open Forum,https://tw.forumosa.com/t/my-name-is-white-supremacy/204521,1260,"April 5, 2021"
36,Coronavirus - Taiwan 2021,Living in Taiwan,https://tw.forumosa.com/t/coronavirus-taiwan-2021/200866,66514,"June 1, 2021"
37,Coronavirus Vaccine in Taiwan - May/June 2021,Health & Fitness,https://tw.forumosa.com/t/coronavirus-vaccine-in-taiwan-may-june-2021/206715,24992,"July 1, 2021"
38,Precautions when cycling in Taiwan during COVID,Cycling,https://tw.forumosa.com/t/precautions-when-cycling-in-taiwan-during-covid/206611,2947,"August 2, 2021"
39,"How to buy food online during the 2021 Covid-19 outbreak, and after",Food & Drink,https://tw.forumosa.com/t/how-to-buy-food-online-during-the-2021-covid-19-outbreak-and-after/207762,590,"July 22, 2021"
40,Why don’t some of my posts have a heart on?,Site Feedback,https://tw.forumosa.com/t/why-don-t-some-of-my-posts-have-a-heart-on/210035,367,"July 20, 2021"
41,Selected Helpful Posts Related to Covid (May 2021- ),International Travel,https://tw.forumosa.com/t/selected-helpful-posts-related-to-covid-may-2021/207840,994,"July 20, 2021"
42,Tech workers who flocked to Taiwan’s Covid-free haven are now fleeing,Living in Taiwan,https://tw.forumosa.com/t/tech-workers-who-flocked-to-taiwan-s-covid-free-haven-are-now-fleeing/208029,2363,"June 13, 2021"
43,"John Cena, Apologizing to China",International Politics,https://tw.forumosa.com/t/john-cena-apologizing-to-china/207452,1496,"July 2, 2021"
44,Bad interviews,Working in Taiwan,https://tw.forumosa.com/t/bad-interviews/202352,633,"February 4, 2021"
45,A few thoughts on integrating here,Culture & History,https://tw.forumosa.com/t/a-few-thoughts-on-integrating-here/198406,2109,"November 5, 2020"
46,Exploring Taiwanese Indie/Rock Scene,Arts & Entertainment,https://tw.forumosa.com/t/exploring-taiwanese-indie-rock-scene/204838,572,"May 10, 2021"
47,Coronavirus - Taiwan OPEN June 2021,Living in Taiwan,https://tw.forumosa.com/t/coronavirus-taiwan-open-june-2021/207874,25721,"July 2, 2021"
48,How not to get fat,Health & Fitness,https://tw.forumosa.com/t/how-not-to-get-fat/196484,4080,"March 11, 2021"
49,"Interesting ways (not online) meeting new friends/partners in Taiwan, stories? Fun stories",Dating & Relationships,https://tw.forumosa.com/t/interesting-ways-not-online-meeting-new-friends-partners-in-taiwan-stories-fun-stories/205785,1201,"June 11, 2021"
