,title,category,url,num_views,last_reply_date
0,2024.8.22 Dual Nationality Petition - Updates Only,Taiwan Politics,https://tw.forumosa.com/t/2024-8-22-dual-nationality-petition-updates-only/242455,5315,"November 28, 2024"
1,2024 August Dual Nationality Petition Open Discussion,Taiwan Politics,https://tw.forumosa.com/t/2024-august-dual-nationality-petition-open-discussion/243828,4977,"December 10, 2024"
2,Taiwan Rail Model Railway,Living in Taiwan,https://tw.forumosa.com/t/taiwan-rail-model-railway/244036,373,"November 3, 2024"
3,Reminiscing about Taiwan. Care to join?,Living in Taiwan,https://tw.forumosa.com/t/reminiscing-about-taiwan-care-to-join/241005,1713,"June 16, 2024"
4,A foreigner’s rant: the agrochemical abyss of rural Taiwan,Living in Taiwan,https://tw.forumosa.com/t/a-foreigner-s-rant-the-agrochemical-abyss-of-rural-taiwan/239033,1540,"October 7, 2024"
5,Congrats on the New Baby!,Living in Taiwan,https://tw.forumosa.com/t/congrats-on-the-new-baby/238881,519,"March 28, 2024"
6,Most discrimination in Taiwan boils down to laws/regulations requiring household registration,Discrimination in Taiwan,https://tw.forumosa.com/t/most-discrimination-in-taiwan-boils-down-to-laws-regulations-requiring-household-registration/239715,1247,"May 24, 2024"
7,Don't f-in steal bikes in Taiwan,Cycling,https://tw.forumosa.com/t/dont-f-in-steal-bikes-in-taiwan/238819,1327,"March 30, 2024"
8,Taiwan's Windowless Work Environments,Working in Taiwan,https://tw.forumosa.com/t/taiwans-windowless-work-environments/239260,508,"April 7, 2024"
9,"POPEYES was coming, now it's here!",Nationwide Restaurants,https://tw.forumosa.com/t/popeyes-was-coming-now-its-here/238647,7476,"December 16, 2024"
10,A Taitung Thread,Living in Taiwan,https://tw.forumosa.com/t/a-taitung-thread/240336,1655,"December 1, 2024"
11,Funny Pics (Staying Alive in) 2025,Fun & Games,https://tw.forumosa.com/t/funny-pics-staying-alive-in-2025/247580,2418,"January 28, 2025"
12,My Banana,Living in Taiwan,https://tw.forumosa.com/t/my-banana/245946,522,"January 20, 2025"
13,Happy Lunar New Year 2024,Living in Taiwan,https://tw.forumosa.com/t/happy-lunar-new-year-2024/237646,1198,"March 26, 2024"
14,Finally feeling very settled in Taiwan -- We really love it here -- About time to leave?,Living in Taiwan,https://tw.forumosa.com/t/finally-feeling-very-settled-in-taiwan-we-really-love-it-here-about-time-to-leave/240140,1125,"May 16, 2024"
15,The Last Days of Sanity: Madness in the Cram School - A Teacher's Tale,Teaching English in Taiwan,https://tw.forumosa.com/t/the-last-days-of-sanity-madness-in-the-cram-school-a-teachers-tale/238637,2058,"March 31, 2024"
16,Foreigners Behaving Badly in Taiwan,Living in Taiwan,https://tw.forumosa.com/t/foreigners-behaving-badly-in-taiwan/238666,7522,"January 4, 2025"
17,Taipei Polam Kopitiam (Xinyi branch) food poisoning,Greater Taipei Restaurants,https://tw.forumosa.com/t/taipei-polam-kopitiam-xinyi-branch-food-poisoning/238904,3690,"January 10, 2025"
18,What is it actually like to become Taiwanese?,Living in Taiwan,https://tw.forumosa.com/t/what-is-it-actually-like-to-become-taiwanese/239036,2353,"September 11, 2024"
19,Destitute travellers,Living in Taiwan,https://tw.forumosa.com/t/destitute-travellers/242493,1615,"October 21, 2024"
20,Which digital banks in Taiwan refuse to provide services to foreigners?,Discrimination in Taiwan,https://tw.forumosa.com/t/which-digital-banks-in-taiwan-refuse-to-provide-services-to-foreigners/237638,750,"April 2, 2024"
21,"You know you're back in Taiwan, when",Living in Taiwan,https://tw.forumosa.com/t/you-know-youre-back-in-taiwan-when/247437,1080,"January 22, 2025"
22,Insecurity about my appearance in Taiwan,Dating & Relationships,https://tw.forumosa.com/t/insecurity-about-my-appearance-in-taiwan/239479,2908,"June 2, 2024"
23,Busybody amahs,Parenting,https://tw.forumosa.com/t/busybody-amahs/242794,464,"August 9, 2024"
24,Is actively ignoring neighbours and not greeting them normal in Taiwan?,Living in Taiwan,https://tw.forumosa.com/t/is-actively-ignoring-neighbours-and-not-greeting-them-normal-in-taiwan/248044,750,"January 22, 2025"
25,Return of ChewDawg,Living in Taiwan,https://tw.forumosa.com/t/return-of-chewdawg/245027,692,"January 24, 2025"
26,How many of the old timers are still active here?,Open Forum,https://tw.forumosa.com/t/how-many-of-the-old-timers-are-still-active-here/241080,1548,"October 28, 2024"
27,Carnaval en Taipei February 24-25 Taipei Expo Park Yuanshan MRT Maji Square,Greater Taipei Events,https://tw.forumosa.com/t/carnaval-en-taipei-february-24-25-taipei-expo-park-yuanshan-mrt-maji-square/238016,778,"February 25, 2024"
28,An Army Held Out Against the CCP in the Chinese Civil War until 1952,Culture & History,https://tw.forumosa.com/t/an-army-held-out-against-the-ccp-in-the-chinese-civil-war-until-1952/247376,174,"December 25, 2024"
29,Rites of passage to be a waiguoren in Taiwan,Living in Taiwan,https://tw.forumosa.com/t/rites-of-passage-to-be-a-waiguoren-in-taiwan/244530,1562,"January 28, 2025"
30,"South Korea declares martial law (yes, in 2024!)",International Politics,https://tw.forumosa.com/t/south-korea-declares-martial-law-yes-in-2024/246848,1361,"January 15, 2025"
31,"Acid reflux, abdominal pain, and obesity",Health & Fitness,https://tw.forumosa.com/t/acid-reflux-abdominal-pain-and-obesity/238197,700,"April 6, 2024"
32,What the hell is going on in South Africa?,Greater Forumosa,https://tw.forumosa.com/t/what-the-hell-is-going-on-in-south-africa/238755,1225,"October 19, 2024"
33,Death of baby of undocumented migrant workers,Living in Taiwan,https://tw.forumosa.com/t/death-of-baby-of-undocumented-migrant-workers/238683,926,"March 21, 2024"
34,"KMT MP Admits Family-Owned Breakfast Shop Made NT$20,000 per Day",Taiwan Politics,https://tw.forumosa.com/t/kmt-mp-admits-family-owned-breakfast-shop-made-nt-20-000-per-day/239591,1522,"April 27, 2024"
35,Annual Events in Taiwan,Greater Taipei Events,https://tw.forumosa.com/t/annual-events-in-taiwan/241838,521,"December 6, 2024"
36,KMT Parliamentary Clashes - Forced Legislation and Subsequent Protests,Taiwan Politics,https://tw.forumosa.com/t/kmt-parliamentary-clashes-forced-legislation-and-subsequent-protests/240364,5550,"January 27, 2025"
37,:national_park: Hualien & Taitung | NT$500/1000 Travel Subsidies,Taiwan Travel,https://tw.forumosa.com/t/hualien-taitung-nt-500-1000-travel-subsidies/241275,1605,"December 9, 2024"
38,Updated APRC number - New Info Was Sent To Bank Automatically,Visa & Residency,https://tw.forumosa.com/t/updated-aprc-number-new-info-was-sent-to-bank-automatically/238096,342,"February 26, 2024"
39,Any experiences/knowledge about Adoption in Taiwan?,Parenting,https://tw.forumosa.com/t/any-experiences-knowledge-about-adoption-in-taiwan/238198,902,"December 13, 2024"
40,Do you get used to all the shabbiness?,Living in Taiwan,https://tw.forumosa.com/t/do-you-get-used-to-all-the-shabbiness/245611,1441,"January 15, 2025"
41,Trump assassination attempts,US Politics,https://tw.forumosa.com/t/trump-assassination-attempts/242165,4355,"January 21, 2025"
42,Din Tai Fung Breach of Labour Law in Australia,Greater Forumosa,https://tw.forumosa.com/t/din-tai-fung-breach-of-labour-law-in-australia/239372,712,"April 12, 2024"
43,Australian steps on becoming a Taiwanese,Dual Nationality,https://tw.forumosa.com/t/australian-steps-on-becoming-a-taiwanese/239365,906,"April 23, 2024"
44,Typhoons 2024,Living in Taiwan,https://tw.forumosa.com/t/typhoons-2024/240038,19154,"January 15, 2025"
45,Garbage Mountains,Living in Taiwan,https://tw.forumosa.com/t/garbage-mountains/244448,1699,"January 20, 2025"
46,Japan reacts to annoying American Vlogger,Greater Forumosa,https://tw.forumosa.com/t/japan-reacts-to-annoying-american-vlogger/246485,657,"November 24, 2024"
47,:medal_sports: :fr: | 2024 Paris Olympics,Sports,https://tw.forumosa.com/t/2024-paris-olympics/242258,2080,"August 19, 2024"
48,Life in Taiwan > Life in the West: Why We’re Winning!,Living in Taiwan,https://tw.forumosa.com/t/life-in-taiwan-life-in-the-west-why-we-re-winning/245196,611,"October 20, 2024"
49,Mysterious Dark Oxygen,Science & Nature,https://tw.forumosa.com/t/mysterious-dark-oxygen/242471,163,"July 25, 2024"
